day,Downloads,dataset_id,resource_id,Dataset_creation,Resource_creation,Resource_modification,dataset_title,titre_du_jeu_de_donnees,resource_title,titre_du_ressource,institution_EN,institution_FR
"May 1, 2026",1.0,3a277f42-00f4-4b39-8343-364108825661,No resource,2022-03-29,2022-03-29,2026-03-18,Historic bathymetry maps,Cartes bathymétriques historiques,No resources covered,Aucune ressource couverte,Government of Ontario , Gouvernement de l'Ontario
"May 1, 2026",9.0,3b070a33-c13e-4a1f-a5ce-63e3a4d616bc,6b888ac4-7120-46e2-9365-68ff1d3ed8d9,2021-03-19,2021-03-19,2025-03-07,Historical and current Canadian Armed Forces pay scale adjustments for Class A & Class B Non-Commissioned Members,Rajustements historiques et actuels de l'échelle salariale des Forces armées canadiennes pour les militaires du rang de classe A et de classe B ,Historical and current Canadian Armed Forces pay scale adjustments for Class A & Class B Non-Commissioned Members,Rajustements historiques et actuels de l'échelle salariale des Forces armées canadiennes pour les militaires du rang de classe A et de classe B ,National Defence , Défense nationale
"May 1, 2026",5.0,3b070a33-c13e-4a1f-a5ce-63e3a4d616bc,No resource,2021-03-19,2021-03-19,2025-10-27,Historical and current Canadian Armed Forces pay scale adjustments for Class A & Class B Non-Commissioned Members,Rajustements historiques et actuels de l'échelle salariale des Forces armées canadiennes pour les militaires du rang de classe A et de classe B ,No resources covered,Aucune ressource couverte,National Defence , Défense nationale
"May 1, 2026",1.0,3b070a33-c13e-4a1f-a5ce-63e3a4d616bc,bf4f1c58-1d99-4296-aa72-605d582ffb50,2021-03-19,2021-03-19,2025-10-27,Historical and current Canadian Armed Forces pay scale adjustments for Class A & Class B Non-Commissioned Members,Rajustements historiques et actuels de l'échelle salariale des Forces armées canadiennes pour les militaires du rang de classe A et de classe B ,Historical and current Canadian Armed Forces pay scale adjustments for Class A & Class B Non-Commissioned Members,Rajustements historiques et actuels de l'échelle salariale des Forces armées canadiennes pour les militaires du rang de classe A et de classe B ,National Defence , Défense nationale
"May 1, 2026",1.0,3cb4845e-fa06-4fd2-87af-f66a7832f879,3aa60bb0-061e-42a8-9c9a-51a21b61f465,2024-12-11,2026-04-17,2026-04-17,BC Stats Release Tourism Room Revenue and Property Counts subject to MRDT by Jurisdiction,Les statistiques de la Colombie-Britannique publient les recettes des chambres touristiques et le nombre de propriétés soumises à la MRDT par juridiction,Tourism Room Revenue and Property Counts subject to MRDT by Jurisdiction,Les recettes des chambres touristiques et le nombre de propriétés sont soumis au MRDT par juridiction,Government of British Columbia , Gouvernment de la Colombie-Britannique
"May 1, 2026",2.0,3ee497c4-57d7-47f8-b030-2e0c03f8462a,227c55b7-b8ee-4678-ab98-26c000bacb17,2020-06-05,2026-01-28,2026-01-28,Freshwater Atlas Watersheds,Bassins versants de l'Atlas des eaux,FWA_WATERSHEDS_POLY,FWA_WATERSHEDS_POLY,Government of British Columbia , Gouvernment de la Colombie-Britannique
"May 1, 2026",1.0,40b50513-1356-4211-ae08-53580dbd32fa,f7172e82-5eb1-4742-9ea1-558593fbf61e,2023-05-17,2026-04-13,2026-04-13,RCMP Transparency and Trust Strategy Enabled by Open Government,Stratégie de transparence et de confiance facilitée par le gouvernement ouvert de la GRC,RCMP Transparency and Trust Strategy Enabled by Open Government - 2025-2029,Stratégie de transparence et de confiance facilitée par le gouvernement ouvert de la GRC 2025 -2029,Royal Canadian Mounted Police , Gendarmerie royale du Canada
"May 1, 2026",2.0,40e01423-7728-429c-ac9d-2954385ccdfb,No resource,2016-09-24,2016-09-24,2025-11-27,"Bulk data files for all years – releases, disposals, transfers and facility locations","Fichiers de données normalisées pour toutes les années – Rejets, éliminations, transferts et emplacement des installations",No resources covered,Aucune ressource couverte,Environment and Climate Change Canada , Environnement et Changement climatique Canada
"May 1, 2026",1.0,40e01423-7728-429c-ac9d-2954385ccdfb,d34f1fda-98ff-4bf8-a6f0-eb7ef43a7c45,2016-09-24,2025-11-27,2025-11-27,"Bulk data files for all years – releases, disposals, transfers and facility locations","Fichiers de données normalisées pour toutes les années – Rejets, éliminations, transferts et emplacement des installations",NPRI-INRP_ReleasesRejets_1993-present.csv,NPRI-INRP_ReleasesRejets_1993-present.csv,Environment and Climate Change Canada , Environnement et Changement climatique Canada
"May 1, 2026",1.0,42986a95-be23-436e-af15-7c6bf292a2e1,12a8a111-d790-49ce-af7c-ec388345e147,2022-01-19,2022-01-19,2025-12-19,Statistics on the Incentives for Zero-Emission  Vehicles (iZEV) Program - ***Closed: Incentives for Zero-Emission Vehicles (iZEV)***,Statistiques sur le programme d’Incitatifs pour les véhicules à zéro émission (iVZE) - ***Fermé: Incitatifs pour les véhicules zéro émission (iVZE)***,Statistics on the Incentives for Zero-Emission Vehicles Program (iZEV) - Data Dictionary ,Statistiques sur le programme d’Incitatifs pour l’achat de véhicules à zéro émission (iVZE) - Dictionnaire de données,Transport Canada , Transports Canada
"May 1, 2026",3.0,432527ab-7aac-45b5-81d6-7597107a7013,No resource,2017-02-20,2017-02-20,2026-05-01,Proactive Disclosure - Grants and Contributions,Divulgation des octrois de subventions et de contributions ,No resources covered,Aucune ressource couverte,Treasury Board of Canada Secretariat , Secrétariat du Conseil du Trésor du Canada
"May 1, 2026",1.0,43a63c4f-b08e-4c53-99bb-20b90b83c6c0,0157aebd-f515-4d13-a745-62c2322eaccf,2019-04-30,2019-04-30,2025-01-24,Canadian Film or Video Production Tax Credit Program (CPTC) - Certified Productions,Crédit d'impôt pour production cinématographique ou magnétoscopique canadienne (CIPC) - Productions certifiées,List of Certified Productions 1995-2010,Liste des productions certifiées 1995-2010,Canadian Heritage , Patrimoine canadien
"May 1, 2026",1.0,43ea3719-f2ea-4c30-91d2-c8cf9b9b1cef,No resource,2017-03-07,2017-03-07,2023-03-23,Monthly Red Meat Slaughter,Abattage mensuel de viandes rouges,No resources covered,Aucune ressource couverte,Agriculture and Agri-Food Canada , Agriculture et Agroalimentaire Canada
"May 1, 2026",2.0,44046a1e-537b-45f8-9a7a-4a297001b001,No resource,2018-06-06,2018-06-06,2026-03-09,Access to Information requests from Public Services and Procurement Canada,Demandes d'accès à l'information de Services publics et Approvisionnement Canada,No resources covered,Aucune ressource couverte,Public Services and Procurement Canada , Services publics et Approvisionnement Canada
"May 1, 2026",2.0,4444b25a-cd38-46b8-bfb8-15e5d28ba4e7,No resource,2016-09-24,2016-09-24,2026-04-08,Insolvency Statistics in Canada,Statistiques sur l'insolvabilité au Canada ,No resources covered,Aucune ressource couverte,"Innovation, Science and Economic Development Canada "," Innovation, Sciences et Développement économique Canada"
"May 1, 2026",1.0,44a11d09-3f0b-418a-98dd-20a74f1ae32e,bab30c6c-c0b2-4690-a05a-4ba9136b1543,2025-08-13,2026-04-17,2026-04-17,"Alberta population projections, 2025-2051 - Alberta and sub-regions - data tables","Translation of Alberta population projections, 2025-2051 - Alberta and sub-regions - data tables","Alberta population projections 2025-2051 - all assumptions (low, medium and high)","Translation of Alberta population projections 2025-2051 - all assumptions (low, medium and high)",Government of Alberta , Gouvernement de l'Alberta
"May 1, 2026",4.0,46bd8c84-ed61-47c9-b2ac-e689629a4f52,No resource,2022-03-02,2022-03-02,2026-04-13,"Leading indicator, International visitors entering or returning to Canada by air, by country of residence and traveller type","Indicateur avancé, Visiteurs internationaux entrant ou revenant au Canada par voie aérienne, selon le pays de résidence et le type de voyageur",No resources covered,Aucune ressource couverte,Statistics Canada , Statistique Canada
"May 1, 2026",3.0,46bd8c84-ed61-47c9-b2ac-e689629a4f52,d5cb66ec-0a03-4e73-b5fb-1425f75956c2,2022-03-02,2026-04-13,2026-04-13,"Leading indicator, International visitors entering or returning to Canada by air, by country of residence and traveller type","Indicateur avancé, Visiteurs internationaux entrant ou revenant au Canada par voie aérienne, selon le pays de résidence et le type de voyageur",Dataset,Ensembles de données,Statistics Canada , Statistique Canada
"May 1, 2026",1.0,474c87a7-147d-46d4-9ea6-65151007058d,f150e75e-72f6-4026-b888-1574857fd2cc,2021-03-24,2021-03-24,2025-05-12,Enterprise Information Technology Service Management,Passerelle de Rapport du Gestion des Services de Technologies de l'Information d'Entreprise (GSTIE),Enterprise Information Technology Service Management,Passerelle de Rapport du Gestion des Services de Technologies de l'Information d'Entreprise (GSTIE),National Defence , Défense nationale
"May 1, 2026",1.0,476942ae-e4da-4122-86ed-98172c9a05b3,No resource,2022-11-30,2022-11-30,2024-02-22,"Highest level of education by census year, visible minority and generation status: Canada, provinces and territories, census metropolitan areas and census agglomerations","Plus haut niveau de scolarité, selon l’année de recensement, la minorité visible et le statut de génération : Canada, provinces et territoires, régions métropolitaines de recensement et agglomérations de recensement",No resources covered,Aucune ressource couverte,Statistics Canada , Statistique Canada
"May 1, 2026",1.0,477da0bc-a3f8-4054-b7be-3a27a575f413,1ef8bae8-7657-4c6e-be68-d5b37517d2ee,2018-06-21,2018-06-21,2026-01-19,Canada.ca analytics,Analytique pour Canada.ca,Canada.ca analytics (with English labels),Analytique pour Canada.ca (avec des étiquettes en anglais),Employment and Social Development Canada , Emploi et Développement social Canada
"May 1, 2026",1.0,47bd4f2e-1c77-49f8-8406-dc4dca64ee6b,No resource,2016-11-22,2016-11-22,2022-02-23,"Provinces/Territories, Digital Boundary File - 2016 Census","Provinces / Territoires, Fichier numérique des limites - Recensement de 2016",No resources covered,Aucune ressource couverte,Statistics Canada , Statistique Canada
"May 1, 2026",3.0,47caa405-be2b-4e9e-8f53-c478ade2ca74,No resource,2017-02-17,2017-02-17,2026-03-09,Critical Habitat for Species at Risk National Dataset - Canada,Ensemble de données nationales sur l'habitat essentiel des espèces en péril – Canada,No resources covered,Aucune ressource couverte,Environment and Climate Change Canada , Environnement et Changement climatique Canada
"May 1, 2026",1.0,481d6d4d-a536-4df9-9e9c-7473cd2ed89e,84f6cb7b-e0c8-4618-be17-c3385d60bf72,2024-05-22,2026-01-28,2026-01-28,BC Hydrologic Zones,Zones hydrologiques de la Colombie-Britannique,BC Hydrologic Zones,Zones hydrologiques de la Colombie-Britannique,Government of British Columbia , Gouvernment de la Colombie-Britannique
"May 1, 2026",1.0,488875d9-2d7a-4486-92b4-a4336161dc58,No resource,2016-11-22,2016-11-22,2022-02-23,"Census Subdivisions, Cartographic Boundary File - 2016 Census","Subdivisions de recensement, Fichier des limites cartographiques - Recensement de 2016",No resources covered,Aucune ressource couverte,Statistics Canada , Statistique Canada
"May 1, 2026",1.0,49a83996-f59a-49af-9035-06ae19f6abcf,7d7ae36b-fe63-4d83-b5ea-1818f3b768cd,2019-05-28,2026-02-24,2026-02-24,Travel by Canadian residents in Canada and abroad by trip purpose,Voyages des résidents canadiens au Canada et à l'étranger par but de voyage,Dataset,Ensembles de données,Statistics Canada , Statistique Canada
"May 1, 2026",1.0,4a92ffeb-d922-50ae-823b-81bb10331035,4010beb6-cbd3-4d8c-8a5c-a47f24ba6923,2016-09-24,2017-01-26,2017-01-26,"Lakes, Rivers and Names of Canada","Lacs, cours d'eau et toponymes du Canada",Download Bilingual JPEG2000 through HTTP,Télécharger le fichier en format bilingue JPEG2000 via HTTP,Natural Resources Canada , Ressources naturelles Canada
"May 1, 2026",1.0,4a99feef-66dc-44e4-be61-3fe170fb3606,310d63ef-2dc2-4ed3-85c6-90cf41372b64,2025-05-23,2025-05-23,2025-05-23,Ministerial Transition - December 2024,Transition ministérielle - décembre 2024,Ministerial Transition Briefing Binder ,Classeur d'information sur la transition ministérielle ,Royal Canadian Mounted Police , Gendarmerie royale du Canada
"May 1, 2026",1.0,4c6c515f-7c44-4bb6-ab56-c5f79f75f705,No resource,2025-09-29,2025-09-29,2026-04-28,Property and casualty companies,Sociétés d'assurances multirisques,No resources covered,Aucune ressource couverte,Office of the Superintendent of Financial Institutions Canada , Bureau du surintendant des institutions financières Canada
"May 1, 2026",3.0,4c6c515f-7c44-4bb6-ab56-c5f79f75f705,d4c1d98d-c19e-4730-ab2d-6e64160351a7,2025-09-29,2025-09-29,2026-04-20,Property and casualty companies,Sociétés d'assurances multirisques,PC1 - P&C Core Financial Statement Return (Active),PC1 - P&C Relevé des états financiers de base (Actif),Office of the Superintendent of Financial Institutions Canada , Bureau du surintendant des institutions financières Canada
"May 1, 2026",2.0,4cd1d293-bcbf-4e98-81e2-8fb81fc51370,5cb90a1f-a5fe-471a-b34b-74ef251e3800,2016-12-19,2016-12-19,2016-12-19,North Shore - Gaspé Basin Long-term Water Quality Monitoring Data,Données de monitoring de la qualité de l'eau à long terme du bassin de la côte nord - Gaspé,Water-Qual-Eau-Gaspe-2000-present.csv,Water-Qual-Eau-Gaspe-2000-present.csv,Environment and Climate Change Canada , Environnement et Changement climatique Canada
"May 1, 2026",1.0,4cf233c2-f020-4f7a-9b87-1923252fbc24,No resource,2020-06-05,2020-06-05,2026-01-28,ParcelMap BC Parcel Fabric,Tissu ParcelMap BC Parcel,No resources covered,Aucune ressource couverte,Government of British Columbia , Gouvernment de la Colombie-Britannique
"May 1, 2026",3.0,4d339626-98f9-49fe-aede-d64f03fa914f,37149be5-bf27-46e9-ade0-0d81c39c2c07,2021-01-27,2026-04-17,2026-04-17,Ontario top baby names (female),Noms de nouveau-né les plus répandus en Ontario (Femme),Ontario top baby names (female),Noms de nouveau-né les plus répandus en Ontario (femelle),Government of Ontario , Gouvernement de l'Ontario
"May 1, 2026",2.0,4dab5b98-b97b-7ba7-9c23-b3eaf8e8d762,85543f4c-607a-4039-b6a0-b10e44576c8a,2022-05-03,2026-04-17,2026-04-17,Unclaimed Estate or Trust Funds Database,Translation of Unclaimed Estate or Trust Funds Database,Unclaimed Estate or Trust Funds Database (CSV Excel),Translation of Unclaimed Estate or Trust Funds Database (CSV Excel),Government of Nova Scotia , Gouvernment de la Nouvelle-Écosse
"May 1, 2026",4.0,4dab5b98-b97b-7ba7-9c23-b3eaf8e8d762,No resource,2022-05-03,2022-05-03,2026-04-17,Unclaimed Estate or Trust Funds Database,Translation of Unclaimed Estate or Trust Funds Database,No resources covered,Aucune ressource couverte,Government of Nova Scotia , Gouvernment de la Nouvelle-Écosse
"May 1, 2026",3.0,4eee1558-45b7-4484-9336-e692897d393f,21432a41-a8ba-4418-8699-30c61bf0283b,2017-08-25,2021-08-31,2025-12-12,Historical Transfer Tables: 1980 to present,Tableaux de transferts historiques : 1980 au présent,Associated Equalization,Péréquation associée,Department of Finance Canada , Ministère des Finances Canada
"May 1, 2026",1.0,4eee1558-45b7-4484-9336-e692897d393f,5d329365-852c-4f5a-a3af-2d597fa3e0a4,2017-08-25,2021-01-14,2025-12-12,Historical Transfer Tables: 1980 to present,Tableaux de transferts historiques : 1980 au présent,MAJOR FEDERAL TRANSFERS TO PROVINCES AND TERRITORIES,PRINCIPAUX TRANSFERTS AUX PROVINCES ET AUX TERRITOIRES,Department of Finance Canada , Ministère des Finances Canada
"May 1, 2026",1.0,4eee1558-45b7-4484-9336-e692897d393f,dcac46f5-1032-4ea6-a067-a106450f51b8,2017-08-25,2021-01-14,2025-12-12,Historical Transfer Tables: 1980 to present,Tableaux de transferts historiques : 1980 au présent,MAJOR FEDERAL TRANSFERS TO PROVINCES AND TERRITORIES,PRINCIPAUX TRANSFERTS AUX PROVINCES ET AUX TERRITOIRES,Department of Finance Canada , Ministère des Finances Canada
"May 1, 2026",1.0,4fe645a1-ffcd-40c1-9385-2c771be956a4,27a6e551-6127-4740-990e-04f7b597d327,2023-06-02,2023-06-02,2026-04-29,CanadaBuys contract history ,Contrats octroyés d'AchatsCanada,"Legacy contract history, 2009-01 to 2023-05 (prior to CanadaBuys)","Contrats hérités octroyés, 2009-01 à 2023-05 (avant AchatsCanada)",Public Services and Procurement Canada , Services publics et Approvisionnement Canada
"May 1, 2026",1.0,4fe645a1-ffcd-40c1-9385-2c771be956a4,99833375-1d5a-401f-beaf-2cb76019e19d,2023-06-02,2025-04-02,2026-04-29,CanadaBuys contract history ,Contrats octroyés d'AchatsCanada,"Contact History, 2025-2026","Contrats octroyés, 2025-2026",Public Services and Procurement Canada , Services publics et Approvisionnement Canada
"May 1, 2026",4.0,4fe645a1-ffcd-40c1-9385-2c771be956a4,No resource,2023-06-02,2023-06-02,2026-05-01,CanadaBuys contract history ,Contrats octroyés d'AchatsCanada,No resources covered,Aucune ressource couverte,Public Services and Procurement Canada , Services publics et Approvisionnement Canada
"May 1, 2026",5.0,4fe645a1-ffcd-40c1-9385-2c771be956a4,c2b7c21c-f643-4ad7-a9eb-f8b8372b5d78,2023-06-02,2023-06-02,2026-05-01,CanadaBuys contract history ,Contrats octroyés d'AchatsCanada,"All CanadaBuys contract history, 2023-06-01 onwards","Tous contrats octroyés d’AchatsCanada, 2023-06-01 et après",Public Services and Procurement Canada , Services publics et Approvisionnement Canada
"May 1, 2026",1.0,50248c72-b49e-43a6-a4d4-5388153fd9ec,No resource,2023-04-05,2023-04-05,2026-04-17,"Births, marriages and deaths by municipality and year","Translation of Births, marriages and deaths by municipality and year",No resources covered,Aucune ressource couverte,Government of Alberta , Gouvernement de l'Alberta
"May 1, 2026",3.0,502da2ef-bffa-4d9b-9e9c-a7425ff3c594,No resource,2021-10-28,2021-10-28,2026-03-24,Eastern Canada Commercial Fishing,Pêche Commerciale dans l’Est du Canada,No resources covered,Aucune ressource couverte,Fisheries and Oceans Canada , Pêches et Océans Canada
"May 1, 2026",3.0,508edfe7-0cba-4d76-afe8-d19e42e9df8a,No resource,2020-07-28,2020-07-28,2026-04-09,Ministers’ offices expenses,Dépenses des bureaux des ministres,No resources covered,Aucune ressource couverte,Public Services and Procurement Canada , Services publics et Approvisionnement Canada
"May 1, 2026",1.0,508edfe7-0cba-4d76-afe8-d19e42e9df8a,d1190c4a-e9ea-4f1d-9f58-c16c833d258b,2020-07-28,2025-07-25,2026-01-30,Ministers’ offices expenses,Dépenses des bureaux des ministres,Data file 2024 - 2025,Fichier de données 2024 - 2025,Public Services and Procurement Canada , Services publics et Approvisionnement Canada
"May 1, 2026",1.0,51e22198-146b-464f-8c13-5435c9ad9e40,5d841693-36aa-4b08-af0d-f01dba617457,2025-11-14,2025-11-14,2025-11-14,SSHRC's Performance in 2024-25: Report on Competitions,Rendement du CRSH en 2024-2025 : Rapport sur les concours,SSHRC's Performance in 2024-25: Report on Competitions,Rendement du CRSH en 2024-2025 : Rapport sur les concours,Social Sciences and Humanities Research Council of Canada , Conseil de recherches en sciences humaines du Canada
"May 1, 2026",2.0,522d1b67-30d8-4a34-9b62-5da99b1035e6,a54e6cdf-0a7e-31a7-a3ff-b0b214e35bde,2017-04-28,2025-01-30,2026-04-23,Current valid British Columbia aquaculture licence holders,Liste des détenteurs actuels de permis valides d'aquaculture en Colombie-Britannique,Data - Marine finfish BC aquaculture licence holders - English,Données - Les permis de pisciculture en milieu marin en C.-B. - anglais,Fisheries and Oceans Canada , Pêches et Océans Canada
"May 1, 2026",1.0,522d1b67-30d8-4a34-9b62-5da99b1035e6,c8bec140-c0cd-376e-9468-79576ad8234d,2017-04-28,2025-01-30,2026-04-16,Current valid British Columbia aquaculture licence holders,Liste des détenteurs actuels de permis valides d'aquaculture en Colombie-Britannique,Data - Shellfish BC aquaculture licence holders - English,Données - Les permis de conchyliculture en C.-B. - Anglais,Fisheries and Oceans Canada , Pêches et Océans Canada
"May 1, 2026",1.0,52e4b14b-597a-4ecf-a184-23a6e69b0d57,7b23c676-596a-4d4d-8375-e8ff38ea1c66,2017-04-12,2017-04-12,2024-05-18,Express Entry Permanent Residents – Monthly IRCC Updates,Résidents permanents au titre d’Entrée express - Mises à jour mensuelles d’IRCC ,Canada - Permanent Residents under Express Entry by Gender and Province/Territory,Canada - Résidents permanents au titre d’Entrée express selon le sexe et la province/le territoire,"Immigration, Refugees and Citizenship Canada "," Immigration, Réfugiés et Citoyenneté Canada"
"May 1, 2026",4.0,52e4b14b-597a-4ecf-a184-23a6e69b0d57,No resource,2017-04-12,2017-04-12,2026-04-22,Express Entry Permanent Residents – Monthly IRCC Updates,Résidents permanents au titre d’Entrée express - Mises à jour mensuelles d’IRCC ,No resources covered,Aucune ressource couverte,"Immigration, Refugees and Citizenship Canada "," Immigration, Réfugiés et Citoyenneté Canada"
"May 1, 2026",1.0,53753f06-8b28-42d7-89f7-04cd014323b0,No resource,2016-09-24,2016-09-24,2025-01-06,"Archived, contract history","Archivé, contrats octroyés",No resources covered,Aucune ressource couverte,Public Services and Procurement Canada , Services publics et Approvisionnement Canada
"May 1, 2026",1.0,54ddcf42-e65f-429c-9ef2-6dfe149dbcfd,a87e5b79-4109-41d4-ae2b-772bb1a4912d,2018-06-27,2026-04-21,2026-04-21,"Canada Mortgage and Housing Corporation, housing starts, by type of dwelling and market type in centres 10,000 and over, Canada, provinces, census metropolitan areas and large census agglomerations","Société canadienne d'hypothèques et de logement, logements mis en chantier, par type de logement et par marché visé dans les centres de 10 000 habitants et plus, pour Canada, les provinces, les régions métropolitaines de recensement et les grandes agglomérations du recensement",Dataset,Ensembles de données,Statistics Canada , Statistique Canada
"May 1, 2026",1.0,552cd8ea-8855-4986-b9c1-55328c14ef88,No resource,2023-11-08,2023-11-08,2026-01-27,"Projected population, by projection scenario, age and gender, as of July 1","Population projetée, selon le scénario de projection, l’âge et le genre, au 1er juillet",No resources covered,Aucune ressource couverte,Statistics Canada , Statistique Canada
"May 1, 2026",1.0,55e74459-1894-4153-a9dc-84804971dac0,No resource,2026-03-18,2026-03-18,2026-04-29,Distribution model (MRE) of Bicknell's thrush in Quebec,Modèle de répartition (MRE) de la grive de Bicknell au Québec,No resources covered,Aucune ressource couverte,Government and Municipalities of Québec , Gouvernement et municipalités du Québec
"May 1, 2026",1.0,56578f58-a775-44ea-9cc5-9bf7c78410e6,1d509472-3a30-4a18-bb97-317f81a867cc,2016-09-26,2025-03-26,2025-03-26,Community Well-Being Index,Indice de bien-être des communautés,CSV file - 2011 (in English),Fichier CSV - 2011 (en anglais),Indigenous Services Canada , Services aux Autochtones Canada
"May 1, 2026",1.0,56578f58-a775-44ea-9cc5-9bf7c78410e6,5a2ef704-f245-49be-9634-d54b80020749,2016-09-26,2025-03-26,2025-03-26,Community Well-Being Index,Indice de bien-être des communautés,CSV file - 2021 (in English),Fichier CSV - 2021 (en anglais),Indigenous Services Canada , Services aux Autochtones Canada
"May 1, 2026",2.0,57180b36-3428-4a7f-afe3-2161a6b44ec5,No resource,2024-05-30,2024-05-30,2026-04-13,Data Reference Standard on Government of Canada Organization Names and Codes,Norme référentielle relative aux données sur les noms et les codes des organisations du gouvernement du Canada,No resources covered,Aucune ressource couverte,Treasury Board of Canada Secretariat , Secrétariat du Conseil du Trésor du Canada
"May 1, 2026",1.0,57180b36-3428-4a7f-afe3-2161a6b44ec5,cb5b5566-f599-4d12-abae-8279a0230928,2024-05-30,2024-05-30,2026-04-13,Data Reference Standard on Government of Canada Organization Names and Codes,Norme référentielle relative aux données sur les noms et les codes des organisations du gouvernement du Canada,Organization Information,informations sur l'organisation,Treasury Board of Canada Secretariat , Secrétariat du Conseil du Trésor du Canada
"May 1, 2026",1.0,576850dd-c72b-4a2a-b01c-28eb2a1f3816,10c696a3-791f-4ce5-9960-7fdff5be2aaa,2020-09-14,2026-04-29,2026-04-29,Exceptional forest ecosystem (EFE),Écosystème forestier exceptionnel (EFE),Exceptional forest ecosystem (EFE),Écosystème forestier exceptionnel (EFE),Government and Municipalities of Québec , Gouvernement et municipalités du Québec
"May 1, 2026",1.0,57b2f16d-364e-4111-bdb8-ad607059b469,73ce22c4-21b4-448e-9090-d22364952365,2021-06-22,2023-01-17,2023-01-17,Smartphone personal use and selected smartphone habits by gender and age group,Utilisation de téléphones intelligents à des fins personnelles et certaines habitudes liées à leur utilisation selon le genre et le groupe d'âge,Dataset,Ensembles de données,Statistics Canada , Statistique Canada
"May 1, 2026",1.0,57be7cc5-76e3-4e93-9251-18750210dc40,No resource,2020-06-05,2020-06-05,2026-01-28,MTA - Mineral Mining Divisions with Codes,MTA - Divisions d'extraction de minéraux avec codes,No resources covered,Aucune ressource couverte,Government of British Columbia , Gouvernment de la Colombie-Britannique
"May 1, 2026",1.0,57d7d00f-1602-4cbf-a127-b680b1cdba6a,ab66e051-d086-4d11-a90e-9406e4fa103f,2018-06-27,2026-01-15,2026-01-15,"Consulting services, sales by type of client","Services de conseils, ventes selon le type de client",Dataset,Ensembles de données,Statistics Canada , Statistique Canada
