day,Downloads,dataset_id,resource_id,Dataset_creation,Resource_creation,Resource_modification,dataset_title,titre_du_jeu_de_donnees,resource_title,titre_du_ressource,institution_EN,institution_FR
"May 1, 2026",1.0,000183ed-8864-42f0-ae43-c4313a860720,143cb669-9dca-4c97-beda-e7c857b9ab88,2019-06-07,2026-02-27,2026-02-27,"Principal Mineral Areas, Producing Mines, and Oil and Gas Fields (900A)","Principales régions minières, principales mines productrices, principaux champs de pétrole et de gaz (900A)",Vector dataset of the 900A map,Jeu de données vectorielles de la carte 900A,Natural Resources Canada , Ressources naturelles Canada
"May 1, 2026",1.0,0032ce54-c5dd-4b66-99a0-320a7b5e99f2,164ae5ee-8ba2-447e-a443-0ea42a9b10bc,2016-09-23,2016-10-24,2016-10-24,Federal Corporations,Sociétés de régime fédéral,Federal Corporations,Sociétés de régime fédéral,"Innovation, Science and Economic Development Canada "," Innovation, Sciences et Développement économique Canada"
"May 1, 2026",1.0,004f6b03-ac84-4c7c-90cb-35949e6260bc,aabce4c7-fbf5-4f36-b49d-9b6f6664b295,2018-01-09,2026-04-30,2026-04-30,Maps of reporting facilities – virtual globe format,Cartes des installations ayant soumis une déclaration – Format de visualisation virtuelle de la Terre,NPRI - 2024.kmz,NPRI - 2024.kmz,Environment and Climate Change Canada , Environnement et Changement climatique Canada
"May 1, 2026",1.0,006771a7-cbe0-f0fc-5aa3-4af1e8d11306,No resource,2022-08-10,2022-08-10,2026-01-28,Wetlands,Terres humides,No resources covered,Aucune ressource couverte,Government of New Brunswick , Gouvernement du Nouveau-Brunswick
"May 1, 2026",2.0,009f9a49-c2d9-4d29-a6d4-1a228da335ce,No resource,2017-02-20,2017-02-20,2026-05-01,Proactive Disclosure - Travel Expenses,Divulgation des frais de voyage,No resources covered,Aucune ressource couverte,Treasury Board of Canada Secretariat , Secrétariat du Conseil du Trésor du Canada
"May 1, 2026",1.0,00a331db-121b-445d-b119-35dbbe3eedd9,No resource,2016-09-23,2016-09-23,2026-04-08,National Broadband Data,Données nationales de large bande,No resources covered,Aucune ressource couverte,"Innovation, Science and Economic Development Canada "," Innovation, Sciences et Développement économique Canada"
"May 1, 2026",1.0,0126c7e2-2a49-52de-9090-69e644f6cec7,555ea6ac-79f3-4087-bf46-9b4ffce02425,2016-09-24,2017-01-26,2017-01-26,"Results of the 33rd Federal Election, September 4, 1984",Résultats de la 33e élection fédérale - Le 4 septembre 1984,Download English PDF through HTTP,Télécharger le fichier en format Anglais PDF via HTTP,Natural Resources Canada , Ressources naturelles Canada
"May 1, 2026",1.0,02986ea0-3ab7-4a13-b391-209e535726d9,No resource,2016-09-24,2016-09-24,2026-04-11,"Contractual Obligations (information from Transfer Payment Agreements, Capital Assets, Purchases and Operating Leases), as reported in the Public  Accounts of Canada","Obligations contractuelles (informations sur les accords de paiements de transfert, immobilisations, achats et contrats de location-exploitation), telles que rapportées dans les Comptes publics du Canada",No resources covered,Aucune ressource couverte,Public Services and Procurement Canada , Services publics et Approvisionnement Canada
"May 1, 2026",1.0,03652383-bed9-4170-9a7a-0bdc218ea2bb,4a92ce5f-db27-472e-b755-e2bf0815af14,2023-05-08,2025-07-22,2025-07-22,"Number, percentage and rate of homicide victims, by gender and Indigenous identity","Nombre, pourcentage et taux de victimes d'homicide, selon le genre et l'identité autochtone",Dataset,Ensembles de données,Statistics Canada , Statistique Canada
"May 1, 2026",2.0,05b3abd0-e70f-4b3b-a9c5-acc436bd15b6,No resource,2025-07-29,2025-07-29,2026-04-09,2023 List of charities,Liste des organismes de bienfaisance 2023,No resources covered,Aucune ressource couverte,Canada Revenue Agency , Agence du revenu du Canada
"May 1, 2026",1.0,06022cc0-a31e-4b4c-850d-d4dccda5f3ac,No resource,2016-09-24,2016-09-24,2026-04-30,Database – all data for all years,Base de données – Toutes les données pour toutes les années,No resources covered,Aucune ressource couverte,Environment and Climate Change Canada , Environnement et Changement climatique Canada
"May 1, 2026",1.0,061c8cb7-ca4e-45be-a990-61fce7e7d2dc,No resource,2022-08-10,2022-08-10,2026-04-22,Quebec property assessment rolls,Rôles d'évaluation foncière du Québec,No resources covered,Aucune ressource couverte,Government and Municipalities of Québec , Gouvernement et municipalités du Québec
"May 1, 2026",1.0,061c8cb7-ca4e-45be-a990-61fce7e7d2dc,d006f906-579a-4599-a44c-865e8dcfba4f,2022-08-10,2026-04-22,2026-04-22,Quebec property assessment rolls,Rôles d'évaluation foncière du Québec,Index of the quarterly update of property assessment rolls by municipality,Index de la mise à jour trimestrielle des rôles d’évaluation foncière par municipalité,Government and Municipalities of Québec , Gouvernement et municipalités du Québec
"May 1, 2026",1.0,07653869-f303-46c2-a04e-9ab479b73cbf,0da7755e-038a-4f94-a097-5acbe082a43c,2026-02-12,2026-04-22,2026-04-22,SCANFI v2: the Spatialized CAnadian National Forest Inventory data product,SCANFI v2: Base de données spatialisées de l'inventaire forestier national canadien,"information file: ""_SCANFI_v2_read_me.txt""","fichier d'information: ""_SCANFI_v2_read_me.txt""",Natural Resources Canada , Ressources naturelles Canada
"May 1, 2026",1.0,07875f11-c342-4450-bdaa-0cdeaf43c0c9,71a7bcd3-915a-4b1c-89ac-f2e6095ba11e,2016-09-24,2025-07-21,2025-07-21,Crop (corn) heat units,Unités thermiques de croissance (maïs),Data Product Specification (English),Spécifications du produit (Anglais),Agriculture and Agri-Food Canada , Agriculture et Agroalimentaire Canada
"May 1, 2026",1.0,07c42deb-9435-43b9-a416-7ce316f3893d,109682f3-8455-4450-98ce-ba43d78a3b81,2026-03-17,2026-03-17,2026-03-17,Canada’s Energy Future 2026: Energy Supply and Demand Projections to 2050,Le rapport Avenir énergétique du Canada en 2026 – Offre et demande énergétiques à l’horizon 2050,benchmark-prices-2026,prix-de-reference-2026,Canada Energy Regulator , La Régie de l’énergie du Canada
"May 1, 2026",1.0,07c42deb-9435-43b9-a416-7ce316f3893d,4aa7e906-8382-4a91-913c-a6e80078d66a,2026-03-17,2026-03-17,2026-03-17,Canada’s Energy Future 2026: Energy Supply and Demand Projections to 2050,Le rapport Avenir énergétique du Canada en 2026 – Offre et demande énergétiques à l’horizon 2050,electricity-capacity-2026,capacite-d-electricite-2026,Canada Energy Regulator , La Régie de l’énergie du Canada
"May 1, 2026",1.0,07c42deb-9435-43b9-a416-7ce316f3893d,No resource,2026-03-17,2026-03-17,2026-04-30,Canada’s Energy Future 2026: Energy Supply and Demand Projections to 2050,Le rapport Avenir énergétique du Canada en 2026 – Offre et demande énergétiques à l’horizon 2050,No resources covered,Aucune ressource couverte,Canada Energy Regulator , La Régie de l’énergie du Canada
"May 1, 2026",1.0,07c42deb-9435-43b9-a416-7ce316f3893d,b270cc7a-8b28-4c2e-9de4-76bd98e7e815,2026-03-17,2026-03-17,2026-03-17,Canada’s Energy Future 2026: Energy Supply and Demand Projections to 2050,Le rapport Avenir énergétique du Canada en 2026 – Offre et demande énergétiques à l’horizon 2050,primary-demand-2026,demande-d-energie-primaire-2026,Canada Energy Regulator , La Régie de l’énergie du Canada
"May 1, 2026",1.0,07c42deb-9435-43b9-a416-7ce316f3893d,b67e0e60-3200-4330-b2b2-afb7debca8bf,2026-03-17,2026-03-17,2026-03-17,Canada’s Energy Future 2026: Energy Supply and Demand Projections to 2050,Le rapport Avenir énergétique du Canada en 2026 – Offre et demande énergétiques à l’horizon 2050,end-use-demand-2026,demande-finale-d-energie-2026,Canada Energy Regulator , La Régie de l’énergie du Canada
"May 1, 2026",1.0,0840231b-5bbf-447f-81ce-3ec0673aefc4,No resource,2020-02-20,2020-02-20,2026-04-10,Student Financial Assistance Data for the Canada Student Financial Assistance Program,Les données sur l'aide financière aux étudiants pour le Programme canadien d'aide financière aux étudiants,No resources covered,Aucune ressource couverte,Employment and Social Development Canada , Emploi et Développement social Canada
"May 1, 2026",4.0,094c9b54-a1ca-4aad-935e-2541e5a23b3f,96afd472-924d-4af2-971c-bb7aade8989e,2018-06-27,2026-04-17,2026-04-17,Public disclosure of salary and severance,Translation of Public disclosure of salary and severance,Public disclosure of salary and severance [csv format],Translation of Public disclosure of salary and severance [csv format],Government of Alberta , Gouvernement de l'Alberta
"May 1, 2026",1.0,0a7619fd-2ffe-44b5-9027-3dfcec0866fd,7ba57b86-2c58-4437-a49e-5f6f4af17666,2025-02-13,2025-07-07,2026-01-08,EnerGuide Rating System Open Data,Données ouvertes du Système de cote ÉnerGuide,2025,2025,Natural Resources Canada , Ressources naturelles Canada
"May 1, 2026",5.0,0a7619fd-2ffe-44b5-9027-3dfcec0866fd,No resource,2025-02-13,2025-02-13,2026-03-23,EnerGuide Rating System Open Data,Données ouvertes du Système de cote ÉnerGuide,No resources covered,Aucune ressource couverte,Natural Resources Canada , Ressources naturelles Canada
"May 1, 2026",2.0,0b229ec0-da50-4b29-88da-49c85a5944e2,086873ab-7b22-455a-97fb-cafdda91d225,2020-06-05,2026-01-28,2026-01-28,BC Wild Mountain Sheep Registry - Distribution,Registre des mouflons sauvages de la Colombie-Britannique - Distribution,WLD_WILD_MTN_SHEEP_DISTRIB_SP,WLD_WILD_MTN_SHEEP_DISTRIB_SP,Government of British Columbia , Gouvernment de la Colombie-Britannique
"May 1, 2026",1.0,0cbb9acd-8e62-45d6-b722-993a7cfbf312,6d202914-5004-4dc5-8135-3218c507e961,2023-11-01,2026-04-17,2026-04-17,Tow Zone Program fee schedule,Grille tarifaire du programme pilote des zones de dépannage,Fee schedule,Barème des frais,Government of Ontario , Gouvernement de l'Ontario
"May 1, 2026",1.0,0fe65119-e96e-4a57-8bfe-9d9245fba06b,37005685-6763-4619-b28c-433b9dab7ce3,2020-12-09,2025-03-12,2025-03-12,High Resolution Digital Elevation Model Mosaic (HRDEM Mosaic) - CanElevation Series,Mosaïque du Modèle numérique d'élévation de haute résolution (Mosaïque MNEHR) - Série CanÉlévation,Product services access guide (English),Guide d'accès aux services (Anglais),Natural Resources Canada , Ressources naturelles Canada
"May 1, 2026",1.0,0fe65119-e96e-4a57-8bfe-9d9245fba06b,b34d158c-5780-4b6f-a78f-182b0dfa2727,2020-12-09,2025-03-12,2025-03-12,High Resolution Digital Elevation Model Mosaic (HRDEM Mosaic) - CanElevation Series,Mosaïque du Modèle numérique d'élévation de haute résolution (Mosaïque MNEHR) - Série CanÉlévation,HRDEM Mosaic DTM Metadata,Métadonnée du MNT de la mosaïque MNEHR,Natural Resources Canada , Ressources naturelles Canada
"May 1, 2026",1.0,1018c301-d359-4077-8d9b-4e9fbe6a223f,88dc8a34-dd10-4001-9993-eb9a9588a3f1,2016-09-24,2016-12-01,2016-12-01,Directory of CBSA Offices,Répertoire des bureaux de l'ASFC,Directory of CBSA Offices EN,Répertoire des bureaux de l'ASFC EN,Canada Border Services Agency , Agence des services frontaliers du Canada
"May 1, 2026",3.0,11245675-b047-49fc-8bd1-cc2ce8314a6d,34ddbddb-c7bb-4415-a99a-860c6fbd4785,2023-04-05,2026-04-17,2026-04-17,Frequency and ranking of baby names by year and gender,Fréquence et classement des prénoms de bébé par année et par sexe,Baby names 2021 to 2024,Prénoms de bébé 2021 à 2024,Government of Alberta , Gouvernement de l'Alberta
"May 1, 2026",1.0,11245675-b047-49fc-8bd1-cc2ce8314a6d,No resource,2023-04-05,2023-04-05,2026-04-17,Frequency and ranking of baby names by year and gender,Fréquence et classement des prénoms de bébé par année et par sexe,No resources covered,Aucune ressource couverte,Government of Alberta , Gouvernement de l'Alberta
"May 1, 2026",2.0,1249502d-96f2-45c4-9926-52aae6c4b402,87868f84-3bb2-4f48-ad06-243a57fdee70,2018-06-27,2024-04-02,2024-04-02,"Postsecondary graduates, by province of study and level of study","Diplômés postsecondaires, selon la province d'études et le niveau d'études",Dataset,Ensembles de données,Statistics Canada , Statistique Canada
"May 1, 2026",2.0,12947c16-8a1e-48ec-82d4-6af4bc2adf09,No resource,2016-09-24,2016-09-24,2025-10-15,Land Cover by Ecodistrict,Couverture végétale par l'écodistrict,No resources covered,Aucune ressource couverte,Agriculture and Agri-Food Canada , Agriculture et Agroalimentaire Canada
"May 1, 2026",1.0,12a160a5-fa87-4a79-ad87-b3d440cae7d7,69a7533d-13c0-4a09-b209-24c2ffae6353,2016-09-24,2026-03-09,2026-04-08,Monthly Insolvency Statistics in Canada by North American Industry Classification System (NAICS),Statistiques mensuelles sur l'insolvabilité au Canada selon le Système de classification des industries de l'Amérique du Nord (SCIAN),2025 Monthly Insolvency Statistics in Canada by North American Industry Classification System (NAICS),2025 Statistiques mensuelles sur l'insolvabilité au Canada selon le Système de classification des industries de l'Amérique du Nord (SCIAN),"Innovation, Science and Economic Development Canada "," Innovation, Sciences et Développement économique Canada"
"May 1, 2026",1.0,12e42696-350c-4acf-b0be-6c92c531f377,9b561d22-6ae8-48f5-8d08-d208809fabc8,2018-06-27,2023-01-17,2023-01-17,Ordinary sales results of life insurance in Canada (30 companies participating),Résultats des ventes ordinaires de polices d'assurance-vie au Canada (30 compagnies participant à l'enquête),Dataset,Ensembles de données,Statistics Canada , Statistique Canada
"May 1, 2026",1.0,12f07737-3508-4962-aebd-5bcfc73214b1,9bb88617-35ca-4410-b5af-231eef9c8b70,2018-06-27,2026-04-10,2026-04-10,"Employment by industry, monthly, seasonally adjusted and unadjusted, and trend-cycle, last 5 months","Emploi selon l'industrie, données mensuelles désaisonnalisées et non désaisonnalisées, et tendance-cycle, 5 derniers mois",Dataset,Ensembles de données,Statistics Canada , Statistique Canada
"May 1, 2026",1.0,12f07737-3508-4962-aebd-5bcfc73214b1,No resource,2018-06-27,2018-06-27,2026-04-10,"Employment by industry, monthly, seasonally adjusted and unadjusted, and trend-cycle, last 5 months","Emploi selon l'industrie, données mensuelles désaisonnalisées et non désaisonnalisées, et tendance-cycle, 5 derniers mois",No resources covered,Aucune ressource couverte,Statistics Canada , Statistique Canada
"May 1, 2026",3.0,13564ca4-e330-40a5-9521-bfb1be767147,No resource,2018-04-13,2018-04-13,2026-01-15,CABIN Canadian Aquatic Biomonitoring Network,RCBA Réseau Canadien de Biosurveillance Aquatique,No resources covered,Aucune ressource couverte,Environment and Climate Change Canada , Environnement et Changement climatique Canada
"May 1, 2026",1.0,1358284b-26e7-4c69-abd8-398d3da2c270,69b6fcd5-50c9-43bd-bd18-3f4e031854d0,2025-09-29,2025-09-29,2026-04-20,Life insurance companies,Sociétés d'assurance-vie,LCA - LICAT (Active),LCA - TSAV(Actif),Office of the Superintendent of Financial Institutions Canada , Bureau du surintendant des institutions financières Canada
"May 1, 2026",1.0,1427d389-cd21-4fe2-8ed9-282d9bdcb7e2,No resource,2023-09-14,2023-09-14,2026-01-28,Bathymetric Maps - Open,Cartes bathymétriques - Ouvrir,No resources covered,Aucune ressource couverte,Government of British Columbia , Gouvernment de la Colombie-Britannique
"May 1, 2026",1.0,1661610d-5e69-56a9-a8d1-3d64e4a8e75a,92d56d98-ae39-4c56-9301-2ace1de94af9,2016-09-24,2017-01-26,2017-01-26,North America (2004),Amérique du Nord (2004),Download Bilingual JPG through HTTP,Télécharger le fichier en format bilingue JPG via HTTP,Natural Resources Canada , Ressources naturelles Canada
"May 1, 2026",1.0,1674baf5-6822-4788-afb3-f8659531d7c0,No resource,2016-09-24,2016-09-24,2026-01-14,Patent Register Data,Donnees pour le registre des brevets,No resources covered,Aucune ressource couverte,Health Canada , Santé Canada
"May 1, 2026",1.0,18299357-094e-4552-91a1-0f3a9890deaf,ef08ffc5-b8b0-4f6e-ac59-f3dad6368139,2023-10-13,2023-10-13,2023-10-13,"Book publishers, methods used by businesses locations that reported e-commerce sales","Éditeurs de livres, méthodes utilisées par les emplacements d’entreprises qui ont déclaré des ventes par commerce électronique",Dataset,Ensembles de données,Statistics Canada , Statistique Canada
"May 1, 2026",3.0,18752265-bda3-498c-a4ba-9dfe68cb98da,No resource,2024-06-21,2024-06-21,2025-08-28,Medium Resolution Digital Elevation Model (MRDEM) - CanElevation Series,Modèle numérique d'élévation de moyenne résolution (MNEMR) - Série CanÉlévation,No resources covered,Aucune ressource couverte,Natural Resources Canada , Ressources naturelles Canada
"May 1, 2026",1.0,18c0e073-6ce2-4dc0-bbc6-44dcc55adb2f,96f0aa59-ca98-4355-a494-3f753972802b,2020-08-19,2020-08-19,2024-11-20,Common Core Document of Canada,Document de base commun du Canada,Common Core Document of Canada,Document de base commun du Canada,Canadian Heritage , Patrimoine canadien
"May 1, 2026",6.0,1a63b19e-2a86-4d4d-a36d-93d94f813187,No resource,2016-09-24,2016-09-24,2026-04-28,"Canada Pension Plan (CPP) - Number of New Benefits, by Place of Residence and Benefit Type","Régime de pensions du Canada (RPC) - Nombre de nouvelles prestations, selon le lieu de résidence et le type de prestation",No resources covered,Aucune ressource couverte,Employment and Social Development Canada , Emploi et Développement social Canada
"May 1, 2026",1.0,1b026aab-edb3-4d5d-8231-270a09ed4e82,ed0a3a5b-f320-44fe-94d9-cc73b7cb0248,2016-10-17,2016-10-17,2024-05-18,Transition from Temporary Resident to Permanent Resident Status – Monthly IRCC Updates,Transition du statut de résident temporaire au statut de résident permanent  – Mises à jour mensuelles d’IRCC,Canada –  Permanent Residents with Prior Study Permit Holder Status by Province/Territory  and Immigration Category,Canada - Résidents permanents ayant le statut des titulaires de permis d'études selon la province/le territoire et la catégorie d'immigration,"Immigration, Refugees and Citizenship Canada "," Immigration, Réfugiés et Citoyenneté Canada"
"May 1, 2026",1.0,1b1c2b92-b388-47d9-87d4-01aee8d3c3e4,22653cdd-d1e2-4c04-9d11-61b5cdd79b4e,2023-05-31,2023-05-31,2025-12-16,Traveller volumes by port of entry and month,Volume de voyageurs par port d’entrée et mois,Traveller Volumes by Port of Entry and month,Volume de voyageurs par port d’entrée et mois,Canada Border Services Agency , Agence des services frontaliers du Canada
"May 1, 2026",6.0,1b801275-49fc-4bb9-89a7-b968453becb5,No resource,2023-11-08,2023-11-08,2023-11-08,"Projected population by racialized group, generation status and other selected characteristics","Population projetée selon le groupe racisé, le statut des générations, et certaines caractéristiques sélectionnées",No resources covered,Aucune ressource couverte,Statistics Canada , Statistique Canada
"May 1, 2026",1.0,1bd8313d-afc9-472e-94e7-e2dc73ab82cd,No resource,2018-06-27,2018-06-27,2026-04-17,Fish stocking report,Translation of Fish stocking report,No resources covered,Aucune ressource couverte,Government of Alberta , Gouvernement de l'Alberta
"May 1, 2026",1.0,1c3d15f9-9cfa-4010-8462-0d67e493d9b9,25a85034-72db-4878-8086-6c3b510b603a,2016-09-24,2026-02-10,2026-02-10,Canadian Disaster Database,Base de données canadienne sur les catastrophes,CDD_Extract_2022_FR,BDC_Extrait_2022_FR,Public Safety Canada , Sécurité publique Canada
"May 1, 2026",1.0,1d946396-cf9a-4fa1-8942-4541063bfba4,No resource,2019-03-18,2019-03-18,2021-07-22,Detailed categorization results of the Domestic Substances List,Résultats détaillés de la catégorisation de la liste intérieure des substances,No resources covered,Aucune ressource couverte,Environment and Climate Change Canada , Environnement et Changement climatique Canada
"May 1, 2026",1.0,1e702c06-9711-451e-acc2-e79c18d205d7,No resource,2021-01-27,2021-01-27,2026-04-08,Occupational Health and Safety events report,Rapport sur des incidents relevant de la santé et de la sécurité au travail,No resources covered,Aucune ressource couverte,Government of Ontario , Gouvernement de l'Ontario
"May 1, 2026",1.0,1eb9eba7-71d1-4b30-9fb1-30cbdab7e63a,21eb7966-38da-4814-a80e-521bce6c4c27,2016-09-24,2022-02-23,2024-11-20,National Collision Database,Base nationale de données sur les collisions,National Collision Database - Data Dictionary,Base nationale de données sur les collisions - Dictionnaire de données,Transport Canada , Transports Canada
"May 1, 2026",1.0,1eb9eba7-71d1-4b30-9fb1-30cbdab7e63a,No resource,2016-09-24,2016-09-24,2025-12-17,National Collision Database,Base nationale de données sur les collisions,No resources covered,Aucune ressource couverte,Transport Canada , Transports Canada
"May 1, 2026",1.0,1eb9eba7-71d1-4b30-9fb1-30cbdab7e63a,f964d00f-6bba-44be-ae79-85f574d04a31,2016-09-24,2025-01-17,2025-01-17,National Collision Database,Base nationale de données sur les collisions,National Collision Database (2021),Base nationale de données sur les collisions (2021),Transport Canada , Transports Canada
"May 1, 2026",1.0,1f711bda-8953-46df-a09f-a66035a01717,e9fd4189-2ffb-4cfe-b0e3-d5252081b2d3,2021-01-27,2026-02-11,2026-02-11,Suspension rates by school board,Taux de suspension à l’échelle du conseil scolaire,Suspension rates by school board,Taux de suspension par conseil scolaire,Government of Ontario , Gouvernement de l'Ontario
"May 1, 2026",1.0,1f73ba41-3f30-445c-bd5a-e8d7c1689c56,No resource,2016-11-22,2016-11-22,2022-02-23,"Census Consolidated Subdivisions, Cartographic Boundary File - 2016 Census","Subdivisions de recensement unifiées, Fichier des limites cartographiques - Recensement de 2016",No resources covered,Aucune ressource couverte,Statistics Canada , Statistique Canada
"May 1, 2026",2.0,1f8d838e-f738-4549-8019-edfc0d931cd7,2f960711-2447-472d-81b0-731fdfbf59a1,2022-11-04,2022-11-04,2026-03-27,Cannabis Market Data,Données sur le marché du cannabis,Cannabis market data - Inventory and Sales,Données sur le marché du cannabis - stock et ventes,Health Canada , Santé Canada
"May 1, 2026",1.0,1f92c111-2dfd-4dba-94f0-e62e12d42c5b,No resource,2025-03-22,2025-03-22,2026-04-09,GC HR and Pay - Executive Level Union-Management Consultation Committee (UMCC) on Phoenix,RH et paye du GC - Comité consultation syndicale-patronale (CCSP) sur Phénix au niveau des cadres,No resources covered,Aucune ressource couverte,Public Services and Procurement Canada , Services publics et Approvisionnement Canada
"May 1, 2026",1.0,1feee3b5-8068-4dbb-b361-180875837593,08e5b494-e7e8-4082-8e3e-e8df0f4f28c6,2021-12-09,2021-12-09,2026-04-08,National Occupational Classification (NOC) 2021 Version 1.0,Classification nationale des professions (CNP) 2021 version 1.0,National Occupational Classification (NOC) 2021 Version 1.0 - Classification structure,Classification nationale des professions (CNP) 2021 version 1.0 - Structure de la classification,Statistics Canada , Statistique Canada
"May 1, 2026",1.0,1feee3b5-8068-4dbb-b361-180875837593,8646b3c4-ba95-47c1-a615-fd44467e838c,2021-12-09,2021-12-09,2026-04-08,National Occupational Classification (NOC) 2021 Version 1.0,Classification nationale des professions (CNP) 2021 version 1.0,National Occupational Classification (NOC) 2021 Version 1.0 - Classification structure,Classification nationale des professions (CNP) 2021 version 1.0 - Structure de la classification,Statistics Canada , Statistique Canada
"May 1, 2026",4.0,1feee3b5-8068-4dbb-b361-180875837593,No resource,2021-12-09,2021-12-09,2026-04-10,National Occupational Classification (NOC) 2021 Version 1.0,Classification nationale des professions (CNP) 2021 version 1.0,No resources covered,Aucune ressource couverte,Statistics Canada , Statistique Canada
"May 1, 2026",1.0,203bb08d-fdff-46f6-93ec-00e5d1d76a81,2c14f3a3-810b-4fd1-83fd-1521ea35b885,2025-09-29,2025-11-07,2025-11-07,Trust companies,Sociétés de fiducie,Sociétés de fiducie - Manuel d'utilisation,Sociétés de fiducie - Manuel d'utilisation,Office of the Superintendent of Financial Institutions Canada , Bureau du surintendant des institutions financières Canada
"May 1, 2026",1.0,20e546a9-f626-4e14-bdac-56f6803daf5b,36e78a39-f036-4a8d-a3ae-7f0d9345984a,2024-10-02,2024-10-02,2025-01-22,GC HR and Pay - Unified Actions for Pay,RH et paye du GC – Actions unifiées pour la paye,Best HR and Pay Practices – Everyone Has a Role to Play (FAQ),Meilleures pratiques en matière de RH et de paye – Chacun a un rôle à jouer (FAQ),Public Services and Procurement Canada , Services publics et Approvisionnement Canada
"May 1, 2026",1.0,219daf65-7336-4dc8-8fd4-360bcad9ffeb,1973ac01-b3fc-4ae6-be32-71f5de9c3108,2020-06-04,2020-06-05,2025-10-17,Number of Canadian Abroad Registrants per region and country daily count,"Nombre d'inscrits canadiens à l'étranger par région et pays, nombre quotidien",Number of Canadian Abroad Registrants per region and country daily count ,"Nombre d'inscrits canadiens à l'étranger par région et pays, nombre quotidien",Global Affairs Canada , Affaires mondiales Canada
"May 1, 2026",1.0,21f39629-88f1-4cc4-bbef-cb34276d0685,55457fa7-5d8e-4c84-9316-dcca7fa054f5,2020-09-11,2026-04-17,2026-04-17,List of collective agreements in force in Quebec,Liste des conventions collectives en vigueur au Québec,"List of collective agreements in force in Quebec on March 11, 2026",Liste des conventions collectives en vigueur au Québec au 11 mars 2026,Government and Municipalities of Québec , Gouvernement et municipalités du Québec
"May 1, 2026",1.0,21ffae40-8e4b-4082-a4f6-3c67f400e126,No resource,2024-09-26,2024-09-26,2025-12-03,Data Reference Standard on Person(s): gender,Norme référentielle relative aux données sur les personnes : genre ,No resources covered,Aucune ressource couverte,Treasury Board of Canada Secretariat , Secrétariat du Conseil du Trésor du Canada
