day,Downloads,dataset_id,resource_id,Dataset_creation,Resource_creation,Resource_modification,dataset_title,titre_du_jeu_de_donnees,resource_title,titre_du_ressource,institution_EN,institution_FR
"May 1, 2026",1.0,7ce06d85-7cc3-4ae3-a5c3-37d7c8d55b08,No resource,2020-11-27,2020-11-27,2025-08-13,Ontario Lake Partner,Partenariat pour la protection des lacs ontariens,No resources covered,Aucune ressource couverte,Government of Ontario , Gouvernement de l'Ontario
"May 1, 2026",1.0,7dffedc4-23fa-440c-a36d-adf5a6cc09f1,cce956c1-556d-4fbb-bb24-20f46e1b39d0,2016-11-09,2016-11-09,2024-06-03,Pipeline Incident Data,Données sur les incidents pipeliniers,Pipeline Incident Data,Données sur les incidents pipeliniers,Canada Energy Regulator , La Régie de l’énergie du Canada
"May 1, 2026",2.0,7f5b2c8f-f3e8-47b2-a5b6-0f736f3613eb,3f3a9648-35ed-4275-8b16-225bc7b15dc7,2020-08-25,2020-08-25,2026-03-27,City rate limits for accommodation of federal public servants,Limites de tarifs d'hébergement par ville pour les fonctionnaires fédéraux,Data file,Fichier de données,Public Services and Procurement Canada , Services publics et Approvisionnement Canada
"May 1, 2026",1.0,7f5b2c8f-f3e8-47b2-a5b6-0f736f3613eb,No resource,2020-08-25,2020-08-25,2026-03-27,City rate limits for accommodation of federal public servants,Limites de tarifs d'hébergement par ville pour les fonctionnaires fédéraux,No resources covered,Aucune ressource couverte,Public Services and Procurement Canada , Services publics et Approvisionnement Canada
"May 1, 2026",1.0,7f625e97-9d02-4c12-a756-1ddebb50e69f,f5f874fe-f0ee-4d8b-9b90-3ee42611ee3c,2025-06-23,2025-06-23,2025-06-23,2024 Public Service Employee Survey Results,Résultats du Sondage auprès des fonctionnaires fédéraux de 2024,Subset 1 - 2024 PSES open dataset - with labels,Sous-ensemble 1 - Ensemble de données ouvertes du SAFF de 2024,Treasury Board of Canada Secretariat , Secrétariat du Conseil du Trésor du Canada
"May 1, 2026",1.0,7fc2f3cd-7c64-449b-95b3-4918bd0f99eb,53949034-a405-4651-8910-390c3d8877da,2023-11-15,2023-11-15,2023-11-15,"Place of work status by main mode of commuting, time leaving for work, and commuting duration: Canada, provinces and territories, census divisions and census subdivisions","Catégorie du lieu de travail selon le mode principal de transport pour la navette, l’heure de départ pour le travail et la durée du navettage : Canada, provinces et territoires, divisions de recensement et subdivisions de recensement",Dataset,Ensembles de données,Statistics Canada , Statistique Canada
"May 1, 2026",2.0,800106c1-0b08-401e-8be2-ac45d62e662e,8b8ac76b-5a6a-43ac-b173-0683da1c2dd6,2016-09-24,2018-03-02,2024-12-31,Television program logs,Registres de télévision ,BroadcastLogs_2018_Q1_M2,BroadcastLogs_2018_Q1_M2,Canadian Radio-television and Telecommunications Commission , Conseil de la radiodiffusion et des télécommunications canadiennes
"May 1, 2026",1.0,809e4442-983a-4943-a2a0-382ba39c227a,974645df-4a9f-43b4-b44a-c3c42e5b6abf,2021-01-27,2026-03-18,2026-03-18,ServiceOntario wait times (in-person),Temps d’attente à ServiceOntario (en personne),ServiceOntario wait times (in-person),ServiceOntario wait times (in-person),Government of Ontario , Gouvernement de l'Ontario
"May 1, 2026",3.0,80a96113-1f7a-4718-92df-4832cd5eb2ba,No resource,2016-09-24,2016-09-24,2025-02-20,Benefits Paid in Countries with which Canada has concluded a Social Security Agreement by Calendar Year,Prestations versées dans les pays avec lesquels le Canada a conclu un accord de sécurité sociale par Année Civile,No resources covered,Aucune ressource couverte,Employment and Social Development Canada , Emploi et Développement social Canada
"May 1, 2026",2.0,80c00cdb-1358-415c-bb8b-0de7f12675b8,No resource,2026-03-06,2026-03-06,2026-03-06,2024 List of charities,Liste des organismes de bienfaisance 2024,No resources covered,Aucune ressource couverte,Canada Revenue Agency , Agence du revenu du Canada
"May 1, 2026",1.0,80c00cdb-1358-415c-bb8b-0de7f12675b8,e9f81074-9fc7-456f-8ce1-6fd101b77963,2026-03-06,2026-03-06,2026-03-06,2024 List of charities,Liste des organismes de bienfaisance 2024,Codes Lists,Listes de codes,Canada Revenue Agency , Agence du revenu du Canada
"May 1, 2026",1.0,82e082be-8f04-4273-830a-8aea63319f07,79883293-cea6-454a-90f3-466c8c747ef1,2019-04-16,2026-03-24,2026-03-24,Known concentration areas of the Sea scallop and the Iceland scallop in the Gulf of St. Lawrence,Aires de concentration connues du Pétoncle géant et du Pétoncle d'Islande dans le golfe du Saint-Laurent,Layer of the known concentration areas of the Sea scallop and the Iceland scallop,Couche des aires de concentration connues du Pétoncle géant et du Pétoncle d'Islande,Fisheries and Oceans Canada , Pêches et Océans Canada
"May 1, 2026",2.0,83320390-7715-43bc-a281-2049bf5d4232,No resource,2021-12-23,2021-12-23,2026-04-09,Official titles of Government of Canada departments and agencies,Noms officiels des ministères et organismes du gouvernement du Canada,No resources covered,Aucune ressource couverte,Treasury Board of Canada Secretariat , Secrétariat du Conseil du Trésor du Canada
"May 1, 2026",1.0,83b4daa4-27b3-4d77-ad4c-eed81a1b75c9,No resource,2016-09-24,2016-09-24,2017-01-30,Cadastral Information for Membertou Indian Reserve No. 28B,Information cadastrale pour la réserve indienne Membertou No 28B,No resources covered,Aucune ressource couverte,Natural Resources Canada , Ressources naturelles Canada
"May 1, 2026",1.0,848e943b-1a98-43b8-acb3-ac89af17ea41,No resource,2019-01-14,2019-01-14,2026-03-24,Coastal thermograph network,Réseau des thermographes côtiers,No resources covered,Aucune ressource couverte,Fisheries and Oceans Canada , Pêches et Océans Canada
"May 1, 2026",1.0,849db3e4-6e26-462a-b7dd-db0e6c8325fe,No resource,2021-10-27,2021-10-27,2024-05-30,"Statistics Canada: The National Address Register Release, 2021","Statistique Canada : Registre national des adresses, 2021",No resources covered,Aucune ressource couverte,Statistics Canada , Statistique Canada
"May 1, 2026",1.0,85095fd5-3bb0-495f-ac4a-30cea7b6d145,05428b0e-6172-4b67-b681-2afd98c8babd,2018-06-27,2026-01-09,2026-01-09,"Employee wages by industry, annual","Salaires des employés selon l'industrie, données annuelles",Dataset,Ensembles de données,Statistics Canada , Statistique Canada
"May 1, 2026",1.0,85b3712c-dabd-484c-b9de-1abbffce21d6,No resource,2018-06-27,2018-06-27,2023-01-17,"Labour force survey estimates (LFS), wages of employees by type of work, National Occupational Classification for Statistics (NOC-S), sex and age group, unadjusted for seasonality","Enquête sur la population active (EPA), estimations du salaire des employés selon le genre de travail, la Classification nationale des professions pour statistiques (CNP-S), le sexe et le groupe d'âge, non désaisonnalisées",No resources covered,Aucune ressource couverte,Statistics Canada , Statistique Canada
"May 1, 2026",1.0,85b3712c-dabd-484c-b9de-1abbffce21d6,f3289f70-f3d6-491d-830a-b772b7222927,2018-06-27,2023-01-17,2023-01-17,"Labour force survey estimates (LFS), wages of employees by type of work, National Occupational Classification for Statistics (NOC-S), sex and age group, unadjusted for seasonality","Enquête sur la population active (EPA), estimations du salaire des employés selon le genre de travail, la Classification nationale des professions pour statistiques (CNP-S), le sexe et le groupe d'âge, non désaisonnalisées",Dataset,Ensembles de données,Statistics Canada , Statistique Canada
"May 1, 2026",1.0,8634f1c9-597e-416d-91f2-df24d2ffbeea,No resource,2018-10-17,2018-10-17,2026-05-01,Proactive Disclosure - Departmental Audit Committees,Divulgation proactive - Comités ministériels d'audit,No resources covered,Aucune ressource couverte,Treasury Board of Canada Secretariat , Secrétariat du Conseil du Trésor du Canada
"May 1, 2026",1.0,86d91f04-c564-4f53-8150-2ce95952eebe,dae2aaa8-5cbc-483c-98ac-5034d4796dfa,2018-02-28,2024-11-26,2024-11-26,Notices of Defect,Avis de défaut,Notices_of_Defect_and_Other.xlsx,Notices_of_defect.xlsx,Environment and Climate Change Canada , Environnement et Changement climatique Canada
"May 1, 2026",2.0,8766bf91-d14c-423b-a5d1-ac47f5b4dd22,No resource,2026-04-13,2026-04-13,2026-04-14,2025 Staffing and Non-Partisanship Survey,Sondage sur la dotation et l’impartialité politique de 2025,No resources covered,Aucune ressource couverte,Public Service Commission of Canada , Commission de la fonction publique du Canada
"May 1, 2026",1.0,88d70716-2600-4995-8d5f-86f96e383abf,No resource,2025-01-22,2025-01-22,2025-10-15,World boreal forest and managed boreal forest extent,Étendue de la forêt boréale et de la forêt boréale aménagée à l’échelle mondiale,No resources covered,Aucune ressource couverte,Natural Resources Canada , Ressources naturelles Canada
"May 1, 2026",1.0,88f45a5c-bc57-4483-bc85-2c19bc342039,d583d90e-4aca-43b3-95cb-5137c239d05d,2024-06-11,2024-06-11,2024-12-09,2023 Staffing and Non-Partisanship Survey,Sondage sur la dotation et l’impartialité politique de 2023,List of questions ,Liste de questions,Public Service Commission of Canada , Commission de la fonction publique du Canada
"May 1, 2026",2.0,89898244-aaae-4591-ba9b-fe5cd81d5924,dd50ce04-3150-4f26-b8ab-0ad067489593,2024-03-26,2024-03-26,2024-11-21,Algorithmic Impact Assessment Results - Griffeye Tool,Résultats de l'évaluation de l'incidence algorithmique - Outil Griffeye,Algorithmic Impact Assessment Results - Griffeye Tool,Résultats de l'évaluation de l'incidence algorithmique - Outil Griffeye,Royal Canadian Mounted Police , Gendarmerie royale du Canada
"May 1, 2026",1.0,8a21881f-178a-4160-8789-990a0f2a838c,fcbb0dcc-c796-4fdd-a7a8-87fb6b9babde,2020-09-11,2026-04-17,2026-04-17,List of international organizations in Montreal,Liste des organisations internationales à Montréal,Directory of international organizations,Répertoire organisations internationales,Government and Municipalities of Québec , Gouvernement et municipalités du Québec
"May 1, 2026",4.0,8ac6dd33-b0d3-4eab-a334-5a6283eb7940,9202a555-ba82-4dee-89dc-28f709a400a5,2020-09-14,2026-04-29,2026-04-29,Signage (on-street parking),Signalisation (stationnement sur rue),Signage - Parking,Signalisation- Stationnement,Government and Municipalities of Québec , Gouvernement et municipalités du Québec
"May 1, 2026",1.0,8b280b1e-b4a7-5841-a0a2-5700d49a7969,1070b316-abf7-4ecd-9b92-db98c50a0de2,2016-09-24,2017-01-26,2017-01-26,"Depth, duration and frequency of point rainfall - 60 minute rainfall for 2-year, 5-year, 10 year and 25-year return periods","Hauteur, durée et fréquence des précipitaions ponctuelles - intervalle de 60 minutes et périodes de récurrence de 2, 5, 10 et 25 ans",Download English JPEG through HTTP,Télécharger le fichier en format Anglais JPEG via HTTP,Natural Resources Canada , Ressources naturelles Canada
"May 1, 2026",3.0,8c1daad5-7996-5d6a-8405-fea284b960ea,1c945f0d-fb4a-44ec-92da-20492f8628de,2016-09-24,2017-01-26,2017-01-26,The World,Le monde,Download JPG through HTTP,Télécharger le fichier en format JPG via HTTP,Natural Resources Canada , Ressources naturelles Canada
"May 1, 2026",3.0,8c387c19-9411-c58c-89d3-9e222ea3f50a,3cb38f81-6134-418c-9899-13c03c7b8dd7,2026-01-14,2026-04-17,2026-04-17,2025 - Employee Salaries,Traitements des employés,2025 - Employee Salaries (CSV Excel),Traitements des employés (CSV Excel),Government of New Brunswick , Gouvernement du Nouveau-Brunswick
"May 1, 2026",1.0,8c387c19-9411-c58c-89d3-9e222ea3f50a,5bd43b18-795f-4b2a-8020-8f86692d7a3a,2026-01-14,2026-04-17,2026-04-17,2025 - Employee Salaries,Traitements des employés,2025 - Employee Salaries (TSV),Traitements des employés (TSV),Government of New Brunswick , Gouvernement du Nouveau-Brunswick
"May 1, 2026",3.0,8c387c19-9411-c58c-89d3-9e222ea3f50a,No resource,2026-01-14,2026-01-14,2026-04-17,2025 - Employee Salaries,Traitements des employés,No resources covered,Aucune ressource couverte,Government of New Brunswick , Gouvernement du Nouveau-Brunswick
"May 1, 2026",4.0,8c387c19-9411-c58c-89d3-9e222ea3f50a,fb18822e-19ba-4140-b7a1-0deb5583a607,2026-01-14,2026-04-17,2026-04-17,2025 - Employee Salaries,Traitements des employés,2025 - Employee Salaries (CSV),Traitements des employés (CSV),Government of New Brunswick , Gouvernement du Nouveau-Brunswick
"May 1, 2026",1.0,8dd0ab9b-d45d-4526-9256-c598fbc4ff3a,No resource,2020-09-11,2020-09-11,2026-04-17,Accident reports,Rapports d'accident,No resources covered,Aucune ressource couverte,Government and Municipalities of Québec , Gouvernement et municipalités du Québec
"May 1, 2026",1.0,8dd0ab9b-d45d-4526-9256-c598fbc4ff3a,dc95e62d-dd6d-4620-872f-96dab01900ab,2020-09-11,2026-04-17,2026-04-17,Accident reports,Rapports d'accident,"Accident reports, 2022","Rapports d'accident, 2022",Government and Municipalities of Québec , Gouvernement et municipalités du Québec
"May 1, 2026",1.0,8e0049e1-1f82-5943-9844-edc3289c93e1,f2fed4b7-e570-47aa-a69b-5efe9abbf68a,2016-09-24,2017-01-26,2017-01-26,Geostatistical Areas 1981 Census Divisions and Subdivisions,Secteurs géostatistiques - Recensement de 1981 - Divisions et subdivisions,Download English PDF through HTTP,Télécharger le fichier en format anglais PDF via HTTP,Natural Resources Canada , Ressources naturelles Canada
"May 1, 2026",1.0,8ea29992-ee54-8a1e-2e73-b8e4da3c403f,ac28097a-f793-46c9-b692-54a6bb9b6482,2024-05-08,2026-01-28,2026-01-28,Spruce Budworm L2 Mapping,Cartographie L2 pour la tordeuse des bourgeons de l’épinette,Spruce Budworm L2 Mapping,Cartographie L2 pour la tordeuse des bourgeons de l’épinette,Government of New Brunswick , Gouvernement du Nouveau-Brunswick
"May 1, 2026",1.0,8ec4a9df-b76b-4a67-8f93-cdbc2e040098,139c1476-355f-4052-bde9-e15fc7948909,2016-09-24,2020-02-27,2023-09-09,Government of Canada Employee Contact Information,Information sur les coordonnées des fonctionnaires du gouvernement du Canada,GEDS - Government of Canada Employee Contacts,SAGE - Coordonnées des fonctionnaires,Shared Services Canada , Services partagés Canada
"May 1, 2026",1.0,8ec4a9df-b76b-4a67-8f93-cdbc2e040098,No resource,2016-09-24,2016-09-24,2023-09-09,Government of Canada Employee Contact Information,Information sur les coordonnées des fonctionnaires du gouvernement du Canada,No resources covered,Aucune ressource couverte,Shared Services Canada , Services partagés Canada
"May 1, 2026",2.0,8ec4a9df-b76b-4a67-8f93-cdbc2e040098,a1de6faa-cb68-4f47-aa57-efd46bd8f82b,2016-09-24,2016-12-01,2023-09-09,Government of Canada Employee Contact Information,Information sur les coordonnées des fonctionnaires du gouvernement du Canada,GEDS - Government of Canada Employee Contacts,SAGE - Coordonnées des fonctionnaires,Shared Services Canada , Services partagés Canada
"May 1, 2026",3.0,8f47fd37-7bb5-4d91-9bc1-9fe3c0467989,No resource,2020-09-14,2020-09-14,2026-04-29,Atlas of areas of conservation interest in the St. Lawrence Lowlands,Atlas des territoires d’intérêt pour la conservation dans les Basses-terres du Saint-Laurent,No resources covered,Aucune ressource couverte,Government and Municipalities of Québec , Gouvernement et municipalités du Québec
"May 1, 2026",2.0,90115b00-f9b8-49e8-afa3-b4cff8facaee,3039046e-2905-406f-a9aa-dd49c92cf604,2017-04-12,2017-04-12,2024-05-18,Temporary Residents: Study Permit Holders – Monthly IRCC Updates,Résidents temporaires: Détenteurs de Permis d’étude – Mises à jour mensuelles d’IRCC ,Canada - Study permit holders by country of citizenship and year in which permit(s) became effective,Canada - Titulaires de permis d’études selon le pays de citoyenneté et l'année à laquelle le permis est entré en vigueur,"Immigration, Refugees and Citizenship Canada "," Immigration, Réfugiés et Citoyenneté Canada"
"May 1, 2026",1.0,90115b00-f9b8-49e8-afa3-b4cff8facaee,3897ef92-a491-4bab-b9c0-eb94c8b173ad,2017-04-12,2017-09-07,2024-05-18,Temporary Residents: Study Permit Holders – Monthly IRCC Updates,Résidents temporaires: Détenteurs de Permis d’étude – Mises à jour mensuelles d’IRCC ,Canada - Study permit holders on December 31st by country of citizenship,Canada - Titulaires de permis d’études ayant un permis valide en date du 31 décembre selon le pays de citoyenneté ,"Immigration, Refugees and Citizenship Canada "," Immigration, Réfugiés et Citoyenneté Canada"
"May 1, 2026",9.0,90115b00-f9b8-49e8-afa3-b4cff8facaee,No resource,2017-04-12,2017-04-12,2026-04-22,Temporary Residents: Study Permit Holders – Monthly IRCC Updates,Résidents temporaires: Détenteurs de Permis d’étude – Mises à jour mensuelles d’IRCC ,No resources covered,Aucune ressource couverte,"Immigration, Refugees and Citizenship Canada "," Immigration, Réfugiés et Citoyenneté Canada"
"May 1, 2026",5.0,90115b00-f9b8-49e8-afa3-b4cff8facaee,b505b9bc-d375-4525-af39-afdf25639acf,2017-04-12,2017-04-12,2024-05-18,Temporary Residents: Study Permit Holders – Monthly IRCC Updates,Résidents temporaires: Détenteurs de Permis d’étude – Mises à jour mensuelles d’IRCC ,Canada - Study permit holders by country of citizenship and year in which permit(s) became effective,Canada - Titulaires de permis d’études selon le pays de citoyenneté et l'année à laquelle le permis est entré en vigueur,"Immigration, Refugees and Citizenship Canada "," Immigration, Réfugiés et Citoyenneté Canada"
"May 1, 2026",1.0,90115b00-f9b8-49e8-afa3-b4cff8facaee,b663a97c-61d4-4e17-af51-0cba01ef3a44,2017-04-12,2017-04-12,2024-05-18,Temporary Residents: Study Permit Holders – Monthly IRCC Updates,Résidents temporaires: Détenteurs de Permis d’étude – Mises à jour mensuelles d’IRCC ,Canada - Study permit holders on December 31st by province/territory and study level,Canada -Titulaires de permis d’études en date du 31 décembre selon la province / le territoire et niveau études,"Immigration, Refugees and Citizenship Canada "," Immigration, Réfugiés et Citoyenneté Canada"
"May 1, 2026",1.0,90115b00-f9b8-49e8-afa3-b4cff8facaee,c2866561-bd7b-4859-a275-072039e3dfe3,2017-04-12,2017-04-12,2026-04-22,Temporary Residents: Study Permit Holders – Monthly IRCC Updates,Résidents temporaires: Détenteurs de Permis d’étude – Mises à jour mensuelles d’IRCC ,"Canada – Study permit holders by province/territory, study level, and year in which permit(s) became effective","Canada - Titulaires de permis d’études selon la province / le territoire, niveau d'études envisagé(e) et l'année à laquelle le permis est entré en vigueur","Immigration, Refugees and Citizenship Canada "," Immigration, Réfugiés et Citoyenneté Canada"
"May 1, 2026",1.0,904d1050-b7ff-4f41-a1bb-50b450e962a8,15a5e1f9-6a05-4f8b-ad41-b34a0b3daf86,2021-01-27,2026-02-11,2026-02-11,Wholesale fuel prices,Prix de gros des carburants,Wholesale gasoline prices,Prix de gros de l’essence,Government of Ontario , Gouvernement de l'Ontario
"May 1, 2026",1.0,904d1050-b7ff-4f41-a1bb-50b450e962a8,5355cf44-dad0-448e-a209-d4948d4cf821,2021-01-27,2026-02-11,2026-02-11,Wholesale fuel prices,Prix de gros des carburants,Wholesale diesel prices,Prix de gros du carburant,Government of Ontario , Gouvernement de l'Ontario
"May 1, 2026",1.0,90705678-982e-49db-8f1b-13e93ede3a95,No resource,2022-03-01,2022-03-01,2023-02-17,Staffing and Non-Partisanship Survey 2021,Sondage sur la dotation et l'impartialité politique 2021,No resources covered,Aucune ressource couverte,Public Service Commission of Canada , Commission de la fonction publique du Canada
"May 1, 2026",4.0,90fed587-1364-4f33-a9ee-208181dc0b97,049928ce-0e7f-480b-9983-f5fa46f612ae,2016-09-25,2024-06-20,2024-11-21,Temporary Foreign Worker Program (TFWP): Positive Labour Market Impact Assessment (LMIA) Employers List,Programme des travailleurs étrangers temporaires (PTET): Employeurs ayant obtenu une Étude d'impact sur le marché du travail (EIMT) positive ,"2024Q1-Employers Who Were Issued a Positive Labour Market Impact Assessment (LMIA) by Program Stream, National Occupational Classification (NOC) 2011 and Business Location, January to March 2024","2024T1-Employeurs ayant obtenu une étude d’impact sur le marché du travail  (EIMT) positive, par volet du programme, classification nationale des professions (CNP) 2011 et lieu de affaires, janvier à mars 2024",Employment and Social Development Canada , Emploi et Développement social Canada
"May 1, 2026",31.0,90fed587-1364-4f33-a9ee-208181dc0b97,06512c1b-d4a7-413f-bc1e-fc38de9f9aca,2016-09-25,2026-03-16,2026-03-16,Temporary Foreign Worker Program (TFWP): Positive Labour Market Impact Assessment (LMIA) Employers List,Programme des travailleurs étrangers temporaires (PTET): Employeurs ayant obtenu une Étude d'impact sur le marché du travail (EIMT) positive ,"2025Q4-Employers Who Were Issued a Positive Labour Market Impact Assessment (LMIA) by Program Stream, National Occupational Classification (NOC) 2021 and Business Location, October to December 2025","2025T4-Employeurs ayant obtenu une étude d’impact sur le marché du travail  (EIMT) positive, par volet du programme, classification nationale des professions (CNP) 2021 et lieu de affaires, octobre à décembre 2025",Employment and Social Development Canada , Emploi et Développement social Canada
"May 1, 2026",2.0,90fed587-1364-4f33-a9ee-208181dc0b97,28b9a549-2b64-4c40-8abe-e2ef3d29daa1,2016-09-25,2025-10-23,2025-10-23,Temporary Foreign Worker Program (TFWP): Positive Labour Market Impact Assessment (LMIA) Employers List,Programme des travailleurs étrangers temporaires (PTET): Employeurs ayant obtenu une Étude d'impact sur le marché du travail (EIMT) positive ,"2025Q2-Employers Who Were Issued a Positive Labour Market Impact Assessment (LMIA) by Program Stream, National Occupational Classification (NOC) 2021 and Business Location, April to June 2025","2025T2-Employeurs ayant obtenu une étude d’impact sur le marché du travail  (EIMT) positive, par volet du programme, classification nationale des professions (CNP) 2021 et lieu de affaires, avril à juin 2025",Employment and Social Development Canada , Emploi et Développement social Canada
"May 1, 2026",2.0,90fed587-1364-4f33-a9ee-208181dc0b97,36d1f9d3-9906-4079-8741-c55bf539de3b,2016-09-25,2025-03-18,2025-03-18,Temporary Foreign Worker Program (TFWP): Positive Labour Market Impact Assessment (LMIA) Employers List,Programme des travailleurs étrangers temporaires (PTET): Employeurs ayant obtenu une Étude d'impact sur le marché du travail (EIMT) positive ,"2024Q4-Employers Who Were Issued a Positive Labour Market Impact Assessment (LMIA) by Program Stream, National Occupational Classification (NOC) 2021 and Business Location, October to December 2024","2024T4-Employeurs ayant obtenu une étude d’impact sur le marché du travail  (EIMT) positive, par volet du programme, classification nationale des professions (CNP) 2021 et lieu de affaires, octobre à décembre 2024",Employment and Social Development Canada , Emploi et Développement social Canada
"May 1, 2026",19.0,90fed587-1364-4f33-a9ee-208181dc0b97,3a28dd68-e061-46f4-824f-053ad292ad89,2016-09-25,2026-03-16,2026-03-16,Temporary Foreign Worker Program (TFWP): Positive Labour Market Impact Assessment (LMIA) Employers List,Programme des travailleurs étrangers temporaires (PTET): Employeurs ayant obtenu une Étude d'impact sur le marché du travail (EIMT) positive ,"2025Q4-Employers Who Were Issued a Positive Labour Market Impact Assessment (LMIA) by Program Stream, National Occupational Classification (NOC) 2021 and Business Location, October to December 2025","2025T4-Employeurs ayant obtenu une étude d’impact sur le marché du travail  (EIMT) positive, par volet du programme, classification nationale des professions (CNP) 2021 et lieu de affaires, octobre à décembre 2025",Employment and Social Development Canada , Emploi et Développement social Canada
"May 1, 2026",1.0,90fed587-1364-4f33-a9ee-208181dc0b97,3a5efac6-6332-47a2-b729-733af38705a8,2016-09-25,2020-02-27,2024-11-20,Temporary Foreign Worker Program (TFWP): Positive Labour Market Impact Assessment (LMIA) Employers List,Programme des travailleurs étrangers temporaires (PTET): Employeurs ayant obtenu une Étude d'impact sur le marché du travail (EIMT) positive ,"2019Q4-Employers who were issued a positive Labour Market Impact Assessment (LMIA) by stream, National Occupational Classification (NOC) 2011 and business location in 2019 (October-December)","2019Q4-Employeurs ayant obtenu une étude d’impact sur le marché du travail (EIMT) positive en 2019 (octobre-décembre), par volet, classification nationale des professions (CNP) 2011 et lieu de affaires",Employment and Social Development Canada , Emploi et Développement social Canada
"May 1, 2026",8.0,90fed587-1364-4f33-a9ee-208181dc0b97,3b7a821b-becc-4d96-9e39-0c2849f90c50,2016-09-25,2026-01-07,2026-01-07,Temporary Foreign Worker Program (TFWP): Positive Labour Market Impact Assessment (LMIA) Employers List,Programme des travailleurs étrangers temporaires (PTET): Employeurs ayant obtenu une Étude d'impact sur le marché du travail (EIMT) positive ,"2025Q3-Employers Who Were Issued a Positive Labour Market Impact Assessment (LMIA) by Program Stream, National Occupational Classification (NOC) 2021 and Business Location, July to September 2025","2025T3-Employeurs ayant obtenu une étude d’impact sur le marché du travail  (EIMT) positive, par volet du programme, classification nationale des professions (CNP) 2021 et lieu de affaires, juillet à septembre 2025",Employment and Social Development Canada , Emploi et Développement social Canada
