day,Downloads,dataset_id,resource_id,Dataset_creation,Resource_creation,Resource_modification,dataset_title,titre_du_jeu_de_donnees,resource_title,titre_du_ressource,institution_EN,institution_FR
"May 1, 2026",1.0,be36f85e-e419-4978-9c34-cb5795622595,0047cea8-b036-4703-a79e-2325021caec5,2020-09-11,2026-04-17,2026-04-17,"List of early childhood centers (CPE), daycares and coordinating offices in operation","Liste des centres de la petite enfance (CPE), garderies et bureaux coordonnateurs en fonction",List of early childhood centers (CPE) and day care centers in operation,Liste des centres de la petite enfance (CPE) et des garderies en fonction,Government and Municipalities of Québec , Gouvernement et municipalités du Québec
"May 1, 2026",1.0,be36f85e-e419-4978-9c34-cb5795622595,No resource,2020-09-11,2020-09-11,2026-04-17,"List of early childhood centers (CPE), daycares and coordinating offices in operation","Liste des centres de la petite enfance (CPE), garderies et bureaux coordonnateurs en fonction",No resources covered,Aucune ressource couverte,Government and Municipalities of Québec , Gouvernement et municipalités du Québec
"May 1, 2026",3.0,beee0771-dab9-4be8-9b80-f8e8b3fdfd9d,No resource,2016-09-25,2016-09-25,2025-07-03,Infrastructure Canada Projects,Projets d'Infrastructure Canada,No resources covered,Aucune ressource couverte,"Department of Housing, Infrastructure and Communities "," Ministère du Logement, de l’Infrastructure et des Collectivités"
"May 1, 2026",1.0,bf00b7f4-e370-46b7-94e4-0bdedc98531b,No resource,2016-09-25,2016-09-25,2026-01-06,Canadian Register of Large Vessels,Registre canadien d'immatriculation des gros bâtiments,No resources covered,Aucune ressource couverte,Transport Canada , Transports Canada
"May 1, 2026",2.0,bf4f93fe-8ddf-4ad7-8ed3-92c2c585fbb3,41ddc2c6-ea58-496f-a5d0-f5f09dc23833,2023-08-30,2023-08-30,2023-09-01,"Infographic: Victims of Hate Crime, 2021",Infographie : Victimes de crimes haineux en 2021,"Infographic: Victims of Hate Crime, 2021",Infographie : Victimes de crimes haineux en 2021,Department of Justice Canada , Ministère de la Justice Canada
"May 1, 2026",1.0,bfab5876-77e5-4dbf-8693-3b0bc69428b8,632c345c-3bf2-4525-b150-322ca9e5b4b1,2017-08-17,2026-04-22,2026-04-22,"Significant New Activity Publications under the Canadian Environmental Protection Act, 1999",Publications relatives aux nouvelles activités en vertu de la Loi canadienne sur la protection de l'environnement (1999),Significant-new-activity-publications.xlsx,Significant-new-activity-publications.xlsx,Environment and Climate Change Canada , Environnement et Changement climatique Canada
"May 1, 2026",1.0,c018c2e5-97f9-4249-b183-097aae572e71,No resource,2018-06-27,2018-06-27,2023-01-17,"Building permits, values by activity sector","Permis de bâtir, valeurs selon le secteur d'activité",No resources covered,Aucune ressource couverte,Statistics Canada , Statistique Canada
"May 1, 2026",1.0,c088f841-2d79-4c7e-9281-cc65cbae1b06,895872b9-390d-42d9-a795-f9f4f79ff52a,2024-03-05,2024-03-05,2024-11-21,Algorithmic Impact Assessment – Pre-load Air Cargo Targeting,Évaluation d'incidence algorithmique – Ciblage du fret aérien préalable au chargement,Algorithmic Impact Assessment – Pre-load Air Cargo Targeting,Évaluation d'incidence algorithmique – Ciblage du fret aérien préalable au chargement,Transport Canada , Transports Canada
"May 1, 2026",1.0,c088f841-2d79-4c7e-9281-cc65cbae1b06,No resource,2024-03-05,2024-03-05,2025-12-04,Algorithmic Impact Assessment – Pre-load Air Cargo Targeting,Évaluation d'incidence algorithmique – Ciblage du fret aérien préalable au chargement,No resources covered,Aucune ressource couverte,Transport Canada , Transports Canada
"May 1, 2026",1.0,c088f841-2d79-4c7e-9281-cc65cbae1b06,acfe70cb-a602-495b-896e-7b51fbaf9e23,2024-03-05,2025-12-04,2025-12-04,Algorithmic Impact Assessment – Pre-load Air Cargo Targeting,Évaluation d'incidence algorithmique – Ciblage du fret aérien préalable au chargement,Peer Review Assessment Report Summary - Pre-load Air Cargo Targeting,Résumé de l'examen par les pairs - Ciblage du fret aérien préalable au chargement,Transport Canada , Transports Canada
"May 1, 2026",1.0,c09bf36c-de88-4ba3-8691-8eab4852c253,No resource,2021-04-13,2021-04-13,2026-01-13,"Deaths, by month","Décès, selon le mois",No resources covered,Aucune ressource couverte,Statistics Canada , Statistique Canada
"May 1, 2026",1.0,c1b0f627-8c29-427c-ab73-33968ad9176e,fe4ee9fe-5f07-4a35-b2e2-646b6abf521e,2016-09-25,2016-10-27,2024-05-04,NSERC's Awards Data,Les données sur les subventions et bourses du CRSNG,Table definition - Awards,Définition de la table - subventions,Natural Sciences and Engineering Research Council of Canada , Conseil de recherches en sciences naturelles et en génie du Canada
"May 1, 2026",1.0,c3125e58-5920-45d3-be29-2f2e1f1dabc1,No resource,2016-09-25,2016-09-25,2020-04-29,"Housing starts, under construction and completions in centres 10,000 and over, Canada, provinces, selected census metropolitan areas","Logements mis en chantier, en construction et achèvements dans les centres de 10 000 habitants et plus, pour Canada, provinces, et certaines régions métropolitaines de recensement",No resources covered,Aucune ressource couverte,Canada Mortgage and Housing Corporation , Société canadienne d'hypothèques et de logement
"May 1, 2026",3.0,c4474517-3d9b-e581-a6e2-e95273f2058e,c68073a1-2146-4861-8fa9-150c2a169590,2019-01-18,2026-03-24,2026-03-24,Community Aquatic Monitoring Program (CAMP) data for the Southern Gulf of St. Lawrence Dataset,Les données de Programme de surveillance de la communauté aquatique (PSCA) du sud du Golfe du Saint-Laurent,Summary by station by year,Résumé par station par année,Fisheries and Oceans Canada , Pêches et Océans Canada
"May 1, 2026",1.0,c48669a3-045b-400d-b730-48aafe8c5ee6,92857939-0e4f-3515-a625-e9770ba34f38,2016-09-25,2025-11-04,2025-11-04,NuSEDS-New Salmon Escapement Database System,NuSEDS - Base de donnèe d'échappement du saumon,West Coast Vancouver Island NuSEDS_20251014.xlsx,Côte ouest de l'île de Vancouver NuSEDS_20251014.xlsx,Fisheries and Oceans Canada , Pêches et Océans Canada
"May 1, 2026",1.0,c4927f47-04af-4734-b76e-116c3c41f680,No resource,2019-04-17,2019-04-17,2026-04-13,"Adjusted household disposable income, Canada, provinces and territories, annual","Revenu disponible ajusté des ménages, Canada, provinces et territoires, annuel",No resources covered,Aucune ressource couverte,Statistics Canada , Statistique Canada
"May 1, 2026",4.0,c4c5c7f1-bfa6-4ff6-b4a0-c164cb2060f7,312a65c5-d0bc-4445-8a24-95b2690cc62b,2016-09-25,2024-02-18,2026-04-30,Open Data Portal Catalogue,Catalogue du portail de données ouvertes,datasets metadata,métadonnées des ensembles de données,Treasury Board of Canada Secretariat , Secrétariat du Conseil du Trésor du Canada
"May 1, 2026",3.0,c4c5c7f1-bfa6-4ff6-b4a0-c164cb2060f7,No resource,2016-09-25,2016-09-25,2026-04-30,Open Data Portal Catalogue,Catalogue du portail de données ouvertes,No resources covered,Aucune ressource couverte,Treasury Board of Canada Secretariat , Secrétariat du Conseil du Trésor du Canada
"May 1, 2026",1.0,c4c5c7f1-bfa6-4ff6-b4a0-c164cb2060f7,b8931c16-0710-4c31-bbda-f60841e98cb4,2016-09-25,2024-02-18,2026-04-30,Open Data Portal Catalogue,Catalogue du portail de données ouvertes,Catalogue,catalogue,Treasury Board of Canada Secretariat , Secrétariat du Conseil du Trésor du Canada
"May 1, 2026",2.0,c4c79395-a0d9-4f32-a5ad-040fde9b292a,No resource,2025-03-14,2025-03-14,2026-04-16,"New motor vehicle sales, monthly","Ventes de véhicules automobiles neufs, mensuelle",No resources covered,Aucune ressource couverte,Statistics Canada , Statistique Canada
"May 1, 2026",1.0,c5eaed22-258d-4796-8dc3-fa957c2f8506,33458167-098e-4f79-94db-bf12eb38303a,2025-12-02,2025-12-02,2025-12-02,Tax-Free Savings Account Statistics (2023 tax year),Statistiques relatives au Compte d'épargne libre d'impôt (année d’imposition 2023),Table 1: TFSA holders,Tableau 1 : Titulaires de CELI,Canada Revenue Agency , Agence du revenu du Canada
"May 1, 2026",1.0,c6085f69-652f-4f33-9b0a-89b24d90ccff,No resource,2020-09-14,2020-09-14,2026-04-22,Fire hydrants,Bornes d'incendie,No resources covered,Aucune ressource couverte,Government and Municipalities of Québec , Gouvernement et municipalités du Québec
"May 1, 2026",1.0,c6c48391-fd2f-4d8a-93c8-eb74f58a859b,No resource,2020-01-06,2020-01-06,2026-01-08,"Population of Canada, 10km Gridded","Population du Canada, mailles de 10 km",No resources covered,Aucune ressource couverte,Agriculture and Agri-Food Canada , Agriculture et Agroalimentaire Canada
"May 1, 2026",1.0,c6ef2768-f261-422c-b0da-e26017c98444,616b7fce-b0b5-4928-9d67-64bed9edc30f,2023-06-30,2023-06-30,2024-05-24,North American Product Classification System (NAPCS) Canada 2022 Version 1.0,Système de classification des produits de l'Amérique du Nord (SCPAN) Canada 2022 version 1.0,North American Product Classification System (NAPCS) Canada 2022 Version 1.0 - Classification structure ,Système de classification des produits de l'Amérique du Nord (SCPAN) Canada 2022 version 1.0 - Structure de la classification,Statistics Canada , Statistique Canada
"May 1, 2026",3.0,c7413d9f-112e-4a26-bbd1-ae2711856629,7e5679e0-bd93-4fe2-871f-86a7bc2479b5,2023-04-13,2026-04-17,2026-04-17,MSP Blue Book,Translation of MSP Blue Book,BlueBook 2014.15 - 2024.25,Translation of BlueBook 2014.15 - 2024.25,Government of British Columbia , Gouvernment de la Colombie-Britannique
"May 1, 2026",1.0,c7413d9f-112e-4a26-bbd1-ae2711856629,No resource,2023-04-13,2023-04-13,2026-04-17,MSP Blue Book,Translation of MSP Blue Book,No resources covered,Aucune ressource couverte,Government of British Columbia , Gouvernment de la Colombie-Britannique
"May 1, 2026",1.0,c77c495a-2a4c-447e-9184-25722289007f,No resource,2020-09-14,2020-09-14,2026-04-29,Traffic flow,Débit de circulation,No resources covered,Aucune ressource couverte,Government and Municipalities of Québec , Gouvernement et municipalités du Québec
"May 1, 2026",2.0,c870a7ac-3e95-4751-5bb2-4690c9f52bab,320c4297-dbc1-49ee-a29d-f6f4cc62f5c5,2024-01-17,2026-04-17,2026-04-17,2023 - Employee Salaries,Traitements des employés,2023 - Employee Salaries (CSV),Traitements des employés (CSV),Government of New Brunswick , Gouvernement du Nouveau-Brunswick
"May 1, 2026",1.0,c870a7ac-3e95-4751-5bb2-4690c9f52bab,d3b7466c-3db9-44cf-90bf-95be28083635,2024-01-17,2026-04-17,2026-04-17,2023 - Employee Salaries,Traitements des employés,2023 - Employee Salaries (CSV Excel),Traitements des employés (CSV Excel),Government of New Brunswick , Gouvernement du Nouveau-Brunswick
"May 1, 2026",1.0,c88e3d88-98df-44ff-8210-963dda56d903,c709a395-462a-4090-91c2-cfbb34e1ea1c,2021-04-13,2024-03-22,2024-03-22,"Postsecondary graduates, by province of study, level of study, field of study and sex, inactive","Diplômés postsecondaires, selon la province d'études, le niveau d'études, le domaine d'études et le sexe, inactif",Dataset,Ensembles de données,Statistics Canada , Statistique Canada
"May 1, 2026",1.0,c922e515-1ac1-442c-8b10-f26e798bab18,No resource,2024-05-30,2024-05-30,2025-11-12,Government of Canada classifications,Classifications du Gouvernement du Canada,No resources covered,Aucune ressource couverte,Treasury Board of Canada Secretariat , Secrétariat du Conseil du Trésor du Canada
"May 1, 2026",2.0,c94e0c13-5385-49c1-9922-822e10135fc6,fb83a27c-d428-42b3-ab3f-ff634ea65942,2020-06-05,2026-01-28,2026-01-28,Geology Faults,Failles géologiques,Geology Faults 2018,Failles géologiques 2018,Government of British Columbia , Gouvernment de la Colombie-Britannique
"May 1, 2026",1.0,c999d1a9-8333-4871-9226-7d3a53f490a6,3623d4f7-7234-49cb-bb1f-aea3a4e4f0ea,2023-03-29,2026-04-22,2026-04-22,Public charging stations for electric cars,Bornes de recharge publiques pour voitures électriques,Public charging stations,Bornes de recharge publiques,Government and Municipalities of Québec , Gouvernement et municipalités du Québec
"May 1, 2026",1.0,cab4826f-4a19-41f8-9041-3f02a1f6d966,7cfa846c-2aef-4621-a15f-cec8d4a989b2,2025-06-04,2025-09-25,2026-01-05,Lighting Products,Matériels d'éclairage,"General Service Lamps 8.80 - Manufactured on or after January 1, 2026","Lamp Standard 8,80 - Fabriquées le 1er janvier 2026 ou après cette date",Natural Resources Canada , Ressources naturelles Canada
"May 1, 2026",1.0,cab4826f-4a19-41f8-9041-3f02a1f6d966,8f6d9e78-92f8-4d60-9cfc-4078c5c40b12,2025-06-04,2025-09-25,2026-01-05,Lighting Products,Matériels d'éclairage,"General Service Lamps 8.80 - Manufactured on or after January 1, 2026","Lamp Standard 8,80 - Fabriquées le 1er janvier 2026 ou après cette date",Natural Resources Canada , Ressources naturelles Canada
"May 1, 2026",1.0,cb1e8d37-c5d4-4171-b99d-b15907d101ee,aa0cc47f-17e6-4f0c-8f9e-fdf3cb176f28,2018-06-27,2026-05-01,2026-05-01,"Business credit outstanding, by supplier type and credit instrument type","Encours de crédit commercial, selon le genre de fournisseur et le type d'instrument de crédit",Dataset,Ensembles de données,Statistics Canada , Statistique Canada
"May 1, 2026",1.0,cb3e0c0c-4c44-4078-96b7-d48ee9aa151c,No resource,2020-09-11,2020-09-11,2026-04-17,Official list of accredited sampling firms offering services to external customers,Liste officielle des firmes d'échantillonnage accréditées offrant des services à la clientèle externe,No resources covered,Aucune ressource couverte,Government and Municipalities of Québec , Gouvernement et municipalités du Québec
"May 1, 2026",1.0,cb69a1cd-7823-4610-bd9c-f6a044513303,d7d00ad0-bdfa-4cd2-83f0-fbb3015c0471,2018-06-27,2023-01-17,2023-01-17,Life insurance sales,Contrats d'assurance sur la vie,Dataset,Ensembles de données,Statistics Canada , Statistique Canada
"May 1, 2026",1.0,cc26db54-a195-4eff-b61e-830cc191f112,No resource,2018-06-27,2018-06-27,2023-01-17,"Sales of liquor, wine and beer, by kind of business and class of customer, Canada, provinces and territories, inactive","Ventes de spiritueux, de vin et de bière, selon le genre de commerce et le type de clientèle, Canada, provinces et territoires, inactif",No resources covered,Aucune ressource couverte,Statistics Canada , Statistique Canada
"May 1, 2026",1.0,cc3ec1dc-d751-4e5c-b99f-e701de7cc211,1a7840c6-95aa-429e-93c0-6270ef95f552,2025-09-24,2026-04-17,2026-04-17,Guilty Record,Registre des déclarations de culpabilité,More information on the conviction register,Information supplémentaire sur le registre de déclaration de culpabilité,Government and Municipalities of Québec , Gouvernement et municipalités du Québec
"May 1, 2026",1.0,cc78b50d-8a8c-433e-9031-28819d32bac4,No resource,2020-06-05,2020-06-05,2026-01-28,"WSA - BC Watershed Groups (50,000)",Groupes de bassins versants de la WSA et de la Colombie-Britannique (50 000),No resources covered,Aucune ressource couverte,Government of British Columbia , Gouvernment de la Colombie-Britannique
"May 1, 2026",1.0,cd04983e-b5b9-5f59-b7fd-4c6113227284,553cc0b3-483e-4aa5-b72e-8ef3beb0ec1d,2016-09-25,2017-01-26,2017-01-26,Canada The 34th Parliament,Canada - Le 34e Parlement,Download English PDF through HTTP,Télécharger le fichier en format anglais PDF via HTTP,Natural Resources Canada , Ressources naturelles Canada
"May 1, 2026",1.0,cd04983e-b5b9-5f59-b7fd-4c6113227284,d83b777c-b913-415c-9552-c0236aacb901,2016-09-25,2017-01-26,2017-01-26,Canada The 34th Parliament,Canada - Le 34e Parlement,Download English JPG through HTTP,Télécharger le fichier en format anglais JPG via HTTP,Natural Resources Canada , Ressources naturelles Canada
"May 1, 2026",3.0,cd8fad92-b276-4250-972f-2d6c40ca04fa,No resource,2021-08-11,2021-08-11,2025-12-03,Data reference standard on Canadian Provinces and Territories,Norme référentielle relative aux données sur les provinces et les territoires du Canada,No resources covered,Aucune ressource couverte,Treasury Board of Canada Secretariat , Secrétariat du Conseil du Trésor du Canada
"May 1, 2026",2.0,cdb0cd06-2a5b-46fb-8553-66c235676360,7e6360c8-2f11-4f95-9a33-bedb5227a89c,2022-09-21,2023-01-17,2023-01-17,"Shelter-cost-to-income ratio by tenure: Canada, provinces and territories, census metropolitan areas and census agglomerations","Rapport des frais de logement au revenu selon le mode d'occupation : Canada, provinces et territoires, régions métropolitaines de recensement et agglomérations de recensement",Dataset,Ensembles de données,Statistics Canada , Statistique Canada
"May 1, 2026",15.0,ceb1ab5a-7d7c-4491-a2f7-560c47c4e22f,648f0b3b-8d21-4373-94b4-72847dbf79a1,2021-03-23,2021-03-23,2025-03-07,Historical and current Canadian Armed Forces  pay scale adjustments for Regular Force and Class C Non-Commissioned Members (NCMs),Ajustements historiques et actuels de l’échelle salariale des Forces armées canadiennes pour les sous-officiers de la Force régulière et de la classe C,Historical and current Canadian Armed Forces  pay scale adjustments for Regular Force and Class C Non-Commissioned Members (NCMs),Ajustements historiques et actuels de l’échelle salariale des Forces armées canadiennes pour les sous-officiers de la Force régulière et de la classe C,National Defence , Défense nationale
"May 1, 2026",14.0,ceb1ab5a-7d7c-4491-a2f7-560c47c4e22f,No resource,2021-03-23,2021-03-23,2025-10-27,Historical and current Canadian Armed Forces  pay scale adjustments for Regular Force and Class C Non-Commissioned Members (NCMs),Ajustements historiques et actuels de l’échelle salariale des Forces armées canadiennes pour les sous-officiers de la Force régulière et de la classe C,No resources covered,Aucune ressource couverte,National Defence , Défense nationale
"May 1, 2026",1.0,ceb1ab5a-7d7c-4491-a2f7-560c47c4e22f,d02053b1-0f36-4561-9984-477297b1ef10,2021-03-23,2021-03-23,2025-10-27,Historical and current Canadian Armed Forces  pay scale adjustments for Regular Force and Class C Non-Commissioned Members (NCMs),Ajustements historiques et actuels de l’échelle salariale des Forces armées canadiennes pour les sous-officiers de la Force régulière et de la classe C,Historical and current Canadian Armed Forces  pay scale adjustments for Regular Force and Class C Non-Commissioned Members (NCMs),Ajustements historiques et actuels de l’échelle salariale des Forces armées canadiennes pour les sous-officiers de la Force régulière et de la classe C,National Defence , Défense nationale
"May 1, 2026",1.0,cebc283f-bae1-4eae-a91f-a26480cd4e4a,No resource,2017-03-29,2017-03-29,2025-02-07,Surficial geology index map,Carte index de la géologie des formations en surface,No resources covered,Aucune ressource couverte,Natural Resources Canada , Ressources naturelles Canada
"May 1, 2026",1.0,cf20699f-1b69-c583-4699-0116074c87fe,a9d87727-b2e6-41a4-a9d8-e7a6232f40b4,2022-04-14,2025-10-01,2025-10-01,Register of Private Career Colleges,Registre des collèges privés d'enseignement professionnel,Register of Private Career Colleges (CSV),Registre des collèges privés d'enseignement professionnel (CSV),Government of Nova Scotia , Gouvernment de la Nouvelle-Écosse
"May 1, 2026",1.0,cff8f63a-f18a-4ae7-bcee-37efb0740bb7,No resource,2021-01-27,2021-01-27,2026-03-11,Municipal Land Use Planning,Aménagement du territoire municipal,No resources covered,Aucune ressource couverte,Government of Ontario , Gouvernement de l'Ontario
"May 1, 2026",2.0,d0cdef71-9343-46c3-b2e7-c1ded5907686,No resource,2016-11-22,2016-11-22,2022-02-23,"Lakes and Rivers (polygons), Boundary files - 2016 Census","Lacs et rivières (polygones),  Fichiers des limites - Recensement de 2016",No resources covered,Aucune ressource couverte,Statistics Canada , Statistique Canada
"May 1, 2026",1.0,d19fc082-5ccf-4412-b137-5e304ffb7679,No resource,2025-11-26,2025-11-26,2026-04-09,2025—Report of the Auditor General of Canada—Recruiting for Canada’s Military,2025 — Rapport de la vérificatrice générale du Canada — Le recrutement pour les forces militaires canadiennes,No resources covered,Aucune ressource couverte,Office of the Auditor General of Canada , Bureau du vérificateur général du Canada
"May 1, 2026",1.0,d1e2048b-ccff-5852-aaa5-b861bd55c367,807af3ed-bc20-4c6b-8537-883d9d0129db,2016-09-25,2026-04-02,2026-04-02,"Permafrost, Atlas of Canada, 5th Edition","Pergélisol, Atlas du Canada, 5e édition","Permafrost, Atlas of Canada, 5th Edition (English PDF Static Map)","Pergélisol, Atlas du Canada, 5e édition (Carte statique PDF en anglais)",Natural Resources Canada , Ressources naturelles Canada
"May 1, 2026",1.0,d23b2e02-085d-43e5-9e6e-e1d558ebfdd5,No resource,2020-09-11,2020-09-11,2026-04-17,Electronic tender system (SEAO),Système électronique d'appel d'offres (SEAO),No resources covered,Aucune ressource couverte,Government and Municipalities of Québec , Gouvernement et municipalités du Québec
"May 1, 2026",1.0,d3881c4c-650d-4070-bf9b-1e00aabf0a1d,No resource,2018-10-04,2018-10-04,2026-03-24,Canadian Hydrographic Service Non-Navigational (NONNA) Bathymetric Data,Données bathymétriques non navigationnelles (NONNA) du Service hydrographique du Canada,No resources covered,Aucune ressource couverte,Fisheries and Oceans Canada , Pêches et Océans Canada
"May 1, 2026",1.0,d38de914-c94c-429b-8ab1-8776c31643e3,7143f1c9-e270-4ae0-9466-7f7485250a8e,2016-09-25,2023-06-13,2025-09-05,Recalls and Safety Alerts,Rappels et avis de sécurité,Recalls and Safety Alerts,Rappels et avis de sécurité,Health Canada , Santé Canada
"May 1, 2026",1.0,d4fb05d0-a894-9331-b44a-0cf97c0eba72,No resource,2023-04-26,2023-04-26,2026-04-17,Manitoba Public Sector Compensation Disclosure,Divulgation de la rémunération du secteur public du Manitoba,No resources covered,Aucune ressource couverte,Government of Manitoba , Gouvernement du Manitoba
"May 1, 2026",1.0,d5ad9eb8-5195-4d1d-83e1-b5afe6b7c737,7b941017-18d9-4803-a6ce-157a470346be,2021-04-13,2024-10-29,2024-10-29,"Assets and debts held by economic family type, by age group, Canada, provinces and selected census metropolitan areas, Survey of Financial Security","Actifs et dettes détenus selon le type de famille économique, par groupe d'âge, Canada, provinces et certaines régions métropolitaines de recensement, enquête sur la sécurité financière",Dataset,Ensembles de données,Statistics Canada , Statistique Canada
"May 1, 2026",1.0,d5ad9eb8-5195-4d1d-83e1-b5afe6b7c737,No resource,2021-04-13,2021-04-13,2024-10-29,"Assets and debts held by economic family type, by age group, Canada, provinces and selected census metropolitan areas, Survey of Financial Security","Actifs et dettes détenus selon le type de famille économique, par groupe d'âge, Canada, provinces et certaines régions métropolitaines de recensement, enquête sur la sécurité financière",No resources covered,Aucune ressource couverte,Statistics Canada , Statistique Canada
"May 1, 2026",2.0,d5ffb2fb-3607-4bda-8f74-2f7b264a9a85,No resource,2018-06-27,2018-06-27,2026-05-01,"Bank of Canada, money market and other interest rates","Taux du marché monétaire et autres taux d'intérêt, Banque du Canada",No resources covered,Aucune ressource couverte,Statistics Canada , Statistique Canada
"May 1, 2026",1.0,d733066f-54be-42c7-bd4f-2ce01d7c46ba,9600f09e-d07d-4d3c-a29b-6a7942e93c7d,2022-09-21,2023-01-17,2023-01-17,"Shelter-cost-to-income ratio by tenure including presence of mortgage payments and subsidized housing : Canada, provinces and territories, census divisions and census subdivisions","Rapport des frais de logement au revenu selon le mode d'occupation incluant la présence de paiements hypothécaires et le logement subventionné : Canada, provinces et territoires, divisions de recensement et subdivisions de recensement",Dataset,Ensembles de données,Statistics Canada , Statistique Canada
"May 1, 2026",1.0,d733066f-54be-42c7-bd4f-2ce01d7c46ba,a16891bb-03a9-4e86-b316-f427ac232b1c,2022-09-21,2023-01-17,2023-01-17,"Shelter-cost-to-income ratio by tenure including presence of mortgage payments and subsidized housing : Canada, provinces and territories, census divisions and census subdivisions","Rapport des frais de logement au revenu selon le mode d'occupation incluant la présence de paiements hypothécaires et le logement subventionné : Canada, provinces et territoires, divisions de recensement et subdivisions de recensement",Dataset,Ensembles de données,Statistics Canada , Statistique Canada
"May 1, 2026",1.0,d74389a9-760a-5ef1-ae02-fac59b5edbdf,2e422328-da8a-4ec5-9cfa-cf067c8c4447,2016-09-25,2017-01-26,2017-01-26,Census Divisions and Subdivions 1971,Divisions et subdivisions de recensement 1971,Download English PDF through HTTP,Télécharger le fichier en format anglais PDF via HTTP,Natural Resources Canada , Ressources naturelles Canada
"May 1, 2026",1.0,d765cc41-8ee0-4aca-be4b-084448e52a58,fec82d43-3cbe-4d91-bf5b-fc0e361ef630,2019-08-01,2025-07-21,2025-07-21,Standardized Precipitation Evapotranspiration Index (SPEI),Indice normalisé précipitations moins évapotranspiration (INPE),Data Product Specification (English),Spécifications du produit (Anglais),Agriculture and Agri-Food Canada , Agriculture et Agroalimentaire Canada
"May 1, 2026",1.0,d83f4d0c-f3b9-4ab9-8b81-b90d174d4f9e,No resource,2016-11-22,2016-11-22,2022-02-23,"Census Divisions, Cartographic Boundary File - 2016 Census","Divisions de recensement, Fichier des limites cartographiques - Recensement de 2016",No resources covered,Aucune ressource couverte,Statistics Canada , Statistique Canada
"May 1, 2026",1.0,d8b114b4-5e55-4b1c-82d4-f5e5710b9048,6aa3fa04-1503-4d81-8830-7ee3df4fcebe,2021-01-27,2026-02-11,2026-02-11,Enterprise Vendor of Record Arrangements,Contrats relatifs aux fournisseurs attitrés,Enterprise Vendor of Record Arrangements,Arrangements relatifs aux fournisseurs d'archives pour les entreprises,Government of Ontario , Gouvernement de l'Ontario
